A1: 投资有风险，入市需谨慎。
A2: 重要声明：这仅仅是非常个人的观点，仅仅是一家之言，绝对不能够作为操作建议。
A3: 更新日期：02-26-2019 ::9:45 讨论股票加微信：indexlook （诚则通达，信则久远，申请加微信的时候务必注明：真实姓名、联系电话、股龄、仓位等。）
A4: 代码 | B4: 名称 | C4: 涨幅% | D4: 总量 | E4: 流通市值 | F4: 换手% | G4: 现价 | H4: 买价 | I4: 卖价 | J4: 现量 | K4: 涨速% | L4: 今开 | M4: 最高 | N4: 最低 | O4: 昨收 | P4: 市盈(动) | Q4: 总金额 | R4: 量比 | S4: 细分行业 | T4: 地区 | U4: 振幅% | V4: 均价 | W4: 内盘 | X4: 外盘 | Y4: 内外比 | Z4: 买量 | AA4: 卖量 | AB4: 涨跌
A5: ="300130" -> 300130 | B5: 新国都 | C5: 7.7199999999999998 | D5: 62635 | E5: 52.79亿 | F5: 1.8700000000000001 | G5: 15.76 | H5: 15.77 | I5: 15.800000000000001 | J5: 100 | K5: 3.1400000000000001 | L5: 15.880000000000001 | M5: 15.890000000000001 | N5: 15.19 | O5: 14.630000000000001 | P5: 46.710000000000001 | Q5: 98059504 | R5: 23.280000000000001 | S5: IT设备 | T5: 深圳 | U5: 4.7800000000000002 | V5: 15.66 | W5: 32173 | X5: 30461 | Y5: 1.0600000000000001 | Z5: 1287 | AA5: 723 | AB5: 1.1299999999999999
A6: ="000860" -> 000860 | B6: 顺鑫农业 | C6: 0.60999999999999999 | D6: 7628 | E6: 243.98亿 | F6: 0.13 | G6: 42.759999999999998 | H6: 42.759999999999998 | I6: 42.770000000000003 | J6: 110 | K6: 0.40000000000000002 | L6: 42.100000000000001 | M6: 42.840000000000003 | N6: 42.100000000000001 | O6: 42.5 | P6: 34.119999999999997 | Q6: 32399152 | R6: 2.8799999999999999 | S6: 白酒 | T6: 北京 | U6: 1.74 | V6: 42.469999999999999 | W6: 2812 | X6: 4815 | Y6: 0.57999999999999996 | Z6: 5 | AA6: 220 | AB6: 0.26000000000000001
A7: ="603369" -> 603369 | B7: 今世缘 | C7: 0.52000000000000002 | D7: 10119 | E7: 241.99亿 | F7: 0.080000000000000002 | G7: 19.289999999999999 | H7: 19.300000000000001 | I7: 19.350000000000001 | J7: 102 | K7: 0 | L7: 19.07 | M7: 19.449999999999999 | N7: 19.07 | O7: 19.190000000000001 | P7: 17.640000000000001 | Q7: 19485080 | R7: 2.6800000000000002 | S7: 白酒 | T7: 江苏 | U7: 1.98 | V7: 19.260000000000002 | W7: 4317 | X7: 5801 | Y7: 0.73999999999999999 | Z7: 5 | AA7: 9 | AB7: 0.10000000000000001
A8: ="600519" -> 600519 | B8: 贵州茅台 | C8: -0.14999999999999999 | D8: 9278 | E8: 9311.19亿 | F8: 0.070000000000000007 | G8: 741.22000000000003 | H8: 741.14999999999998 | I8: 741.60000000000002 | J8: 81 | K8: -0.5 | L8: 747.79999999999995 | M8: 749.17999999999995 | N8: 741.22000000000003 | O8: 742.33000000000004 | P8: 28.23 | Q8: 691330880 | R8: 6.0300000000000002 | S8: 白酒 | T8: 贵州 | U8: 1.0700000000000001 | V8: 745.16999999999996 | W8: 4866 | X8: 4411 | Y8: 1.1000000000000001 | Z8: 1 | AA8: 1 | AB8: -1.1100000000000001
A9: ="002304" -> 002304 | B9: 洋河股份 | C9: -0.34000000000000002 | D9: 6826 | E9: 1365.97亿 | F9: 0.050000000000000003 | G9: 109.8 | H9: 109.73 | I9: 109.8 | J9: 22 | K9: 0 | L9: 110 | M9: 110 | N9: 109.22 | O9: 110.18000000000001 | P9: 17.629999999999999 | Q9: 74976304 | R9: 2.8100000000000001 | S9: 白酒 | T9: 江苏 | U9: 0.70999999999999996 | V9: 109.84 | W9: 2881 | X9: 3944 | Y9: 0.72999999999999998 | Z9: 68 | AA9: 6 | AB9: -0.38
A10: ="600809" -> 600809 | B10: 山西汾酒 | C10: -1.1699999999999999 | D10: 10529 | E10: 418.20亿 | F10: 0.12 | G10: 48.299999999999997 | H10: 48.229999999999997 | I10: 48.299999999999997 | J10: 175 | K10: 0.46000000000000002 | L10: 48.009999999999998 | M10: 48.469999999999999 | N10: 48 | O10: 48.869999999999997 | P10: 24.82 | Q10: 50658364 | R10: 3.4399999999999999 | S10: 白酒 | T10: 山西 | U10: 0.95999999999999996 | V10: 48.109999999999999 | W10: 5547 | X10: 4982 | Y10: 1.1100000000000001 | Z10: 225 | AA10: 1 | AB10: -0.56999999999999995
A11: ="600779" -> 600779 | B11: 水井坊 | C11: -1.3400000000000001 | D11: 6650 | E11: 186.62亿 | F11: 0.14000000000000001 | G11: 38.200000000000003 | H11: 38.219999999999999 | I11: 38.380000000000003 | J11: 123 | K11: -0.79000000000000004 | L11: 38.210000000000001 | M11: 38.700000000000003 | N11: 38.200000000000003 | O11: 38.719999999999999 | P11: 30.25 | Q11: 25536064 | R11: 2.6200000000000001 | S11: 白酒 | T11: 四川 | U11: 1.29 | V11: 38.399999999999999 | W11: 3501 | X11: 3148 | Y11: 1.1100000000000001 | Z11: 30 | AA11: 27 | AB11: -0.52000000000000002
A12: ="000596" -> 000596 | B12: 古井贡酒 | C12: -1.5 | D12: 2574 | E12: 295.53亿 | F12: 0.070000000000000007 | G12: 77.040000000000006 | H12: 77.010000000000005 | I12: 77.049999999999997 | J12: 1 | K12: 0.17999999999999999 | L12: 77.75 | M12: 77.75 | N12: 76.549999999999997 | O12: 78.209999999999994 | P12: 23.170000000000002 | Q12: 19801526 | R12: 1.9299999999999999 | S12: 白酒 | T12: 安徽 | U12: 1.53 | V12: 76.930000000000007 | W12: 1339 | X12: 1235 | Y12: 1.0800000000000001 | Z12: 6 | AA12: 1 | AB12: -1.1699999999999999
A13: ="000679" -> 000679 | B13: 大连友谊 | C13: 1.0900000000000001 | D13: 12115 | E13: 16.46亿 | F13: 0.34000000000000002 | G13: 4.6200000000000001 | H13: 4.6200000000000001 | I13: 4.6299999999999999 | J13: 195 | K13: 1.0900000000000001 | L13: 4.71 | M13: 4.7300000000000004 | N13: 4.54 | O13: 4.5700000000000003 | P13: -- | Q13: 5604943 | R13: 7.2400000000000002 | S13: 百货 | T13: 辽宁 | U13: 4.1600000000000001 | V13: 4.6299999999999999 | W13: 5507 | X13: 6607 | Y13: 0.82999999999999996 | Z13: 21 | AA13: 49 | AB13: 0.050000000000000003
A14: ="002419" -> 002419 | B14: 天虹股份 | C14: -0.62 | D14: 6479 | E14: 154.67亿 | F14: 0.050000000000000003 | G14: 12.890000000000001 | H14: 12.890000000000001 | I14: 12.9 | J14: 47 | K14: 0.55000000000000004 | L14: 12.94 | M14: 12.94 | N14: 12.779999999999999 | O14: 12.970000000000001 | P14: 17.239999999999998 | Q14: 8324451 | R14: 2.3500000000000001 | S14: 百货 | T14: 深圳 | U14: 1.23 | V14: 12.85 | W14: 2695 | X14: 3784 | Y14: 0.70999999999999996 | Z14: 4 | AA14: 11 | AB14: -0.080000000000000002
A15: ="600861" -> 600861 | B15: 北京城乡 | C15: -1.46 | D15: 4654 | E15: 23.51亿 | F15: 0.14999999999999999 | G15: 7.4199999999999999 | H15: 7.4199999999999999 | I15: 7.4400000000000004 | J15: 10 | K15: 0 | L15: 7.4699999999999998 | M15: 7.4800000000000004 | N15: 7.4100000000000001 | O15: 7.5300000000000002 | P15: 57.869999999999997 | Q15: 3462555 | R15: 3.4500000000000002 | S15: 百货 | T15: 北京 | U15: 0.93000000000000005 | V15: 7.4400000000000004 | W15: 2757 | X15: 1897 | Y15: 1.45 | Z15: 197 | AA15: 134 | AB15: -0.11
A16: ="000785" -> 000785 | B16: 武汉中商 | C16: -2.3599999999999999 | D16: 31115 | E16: 28.07亿 | F16: 1.24 | G16: 11.18 | H16: 11.17 | I16: 11.18 | J16: 224 | K16: 0.35999999999999999 | L16: 11.359999999999999 | M16: 11.380000000000001 | N16: 11.09 | O16: 11.449999999999999 | P16: 22.27 | Q16: 34965196 | R16: 2.6899999999999999 | S16: 百货 | T16: 湖北 | U16: 2.5299999999999998 | V16: 11.24 | W16: 18443 | X16: 12672 | Y16: 1.46 | Z16: 24 | AA16: 34 | AB16: -0.27000000000000002
A17: ="600460" -> 600460 | B17: 士兰微 | C17: -1.2 | D17: 83772 | E17: 151.67亿 | F17: 0.64000000000000001 | G17: 11.560000000000001 | H17: 11.550000000000001 | I17: 11.560000000000001 | J17: 347 | K17: 0.089999999999999997 | L17: 11.75 | M17: 11.76 | N17: 11.4 | O17: 11.699999999999999 | P17: 75.140000000000001 | Q17: 96727864 | R17: 3.1600000000000001 | S17: 半导体 | T17: 浙江 | U17: 3.0800000000000001 | V17: 11.550000000000001 | W17: 38799 | X17: 44972 | Y17: 0.85999999999999999 | Z17: 1731 | AA17: 15 | AB17: -0.14000000000000001
A18: ="300046" -> 300046 | B18: 台基股份 | C18: -1.6299999999999999 | D18: 12660 | E18: 28.26亿 | F18: 0.58999999999999997 | G18: 13.26 | H18: 13.25 | I18: 13.26 | J18: 38 | K18: 0.29999999999999999 | L18: 13.35 | M18: 13.35 | N18: 13.199999999999999 | O18: 13.48 | P18: 28.34 | Q18: 16805892 | R18: 3.2200000000000002 | S18: 半导体 | T18: 湖北 | U18: 1.1100000000000001 | V18: 13.27 | W18: 6667 | X18: 5993 | Y18: 1.1100000000000001 | Z18: 292 | AA18: 148 | AB18: -0.22
A19: ="601336" -> 601336 | B19: 新华保险 | C19: 2.4399999999999999 | D19: 80365 | E19: 1076.30亿 | F19: 0.39000000000000001 | G19: 51.609999999999999 | H19: 51.600000000000001 | I19: 51.609999999999999 | J19: 958 | K19: 0.56999999999999995 | L19: 51.890000000000001 | M19: 51.890000000000001 | N19: 50.399999999999999 | O19: 50.380000000000003 | P19: 15.68 | Q19: 412068352 | R19: 6.5199999999999996 | S19: 保险 | T19: 北京 | U19: 2.96 | V19: 51.270000000000003 | W19: 32994 | X19: 47370 | Y19: 0.69999999999999996 | Z19: 35 | AA19: 50 | AB19: 1.23
A20: ="601318" -> 601318 | B20: 中国平安 | C20: -1.3 | D20: 221525 | E20: 7804.94亿 | F20: 0.20000000000000001 | G20: 72.049999999999997 | H20: 72.030000000000001 | I20: 72.049999999999997 | J20: 463 | K20: 0.56000000000000005 | L20: 71.709999999999994 | M20: 72.299999999999997 | N20: 71.329999999999998 | O20: 73 | P20: 12.44 | Q20: 1590137472 | R20: 6.2699999999999996 | S20: 保险 | T20: 深圳 | U20: 1.3300000000000001 | V20: 71.780000000000001 | W20: 98668 | X20: 122857 | Y20: 0.80000000000000004 | Z20: 717 | AA20: 41 | AB20: -0.94999999999999996
A21: ="600176" -> 600176 | B21: 中国巨石 | C21: -0.089999999999999997 | D21: 63797 | E21: 392.26亿 | F21: 0.17999999999999999 | G21: 11.199999999999999 | H21: 11.199999999999999 | I21: 11.210000000000001 | J21: 135 | K21: 0.63 | L21: 11.35 | M21: 11.35 | N21: 11.09 | O21: 11.210000000000001 | P21: 15.380000000000001 | Q21: 71409824 | R21: 3.3599999999999999 | S21: 玻璃 | T21: 浙江 | U21: 2.3199999999999998 | V21: 11.19 | W21: 30236 | X21: 33561 | Y21: 0.90000000000000002 | Z21: 969 | AA21: 126 | AB21: -0.01
A22: ="002120" -> 002120 | B22: 韵达股份 | C22: 2.0800000000000001 | D22: 4547 | E22: 111.67亿 | F22: 0.14999999999999999 | G22: 35.75 | H22: 35.700000000000003 | I22: 35.75 | J22: 35 | K22: 0.81999999999999995 | L22: 35.119999999999997 | M22: 36 | N22: 35.119999999999997 | O22: 35.020000000000003 | P22: 23.18 | Q22: 16155629 | R22: 3.77 | S22: 仓储物流 | T22: 浙江 | U22: 2.5099999999999998 | V22: 35.530000000000001 | W22: 1522 | X22: 3025 | Y22: 0.5 | Z22: 251 | AA22: 75 | AB22: 0.72999999999999998
A23: ="600794" -> 600794 | B23: 保税科技 | C23: -0.33000000000000002 | D23: 24022 | E23: 36.46亿 | F23: 0.20000000000000001 | G23: 3.0600000000000001 | H23: 3.0499999999999998 | I23: 3.0600000000000001 | J23: 151 | K23: 0.98999999999999999 | L23: 3.0699999999999998 | M23: 3.0800000000000001 | N23: 3.02 | O23: 3.0699999999999998 | P23: 95.439999999999998 | Q23: 7315282 | R23: 4.0700000000000003 | S23: 仓储物流 | T23: 江苏 | U23: 1.95 | V23: 3.0499999999999998 | W23: 13384 | X23: 10638 | Y23: 1.26 | Z23: 344 | AA23: 666 | AB23: -0.01
A24: ="601933" -> 601933 | B24: 永辉超市 | C24: -0.22 | D24: 40287 | E24: 723.52亿 | F24: 0.050000000000000003 | G24: 9.0800000000000001 | H24: 9.0800000000000001 | I24: 9.0899999999999999 | J24: 248 | K24: 0.55000000000000004 | L24: 9.0999999999999996 | M24: 9.0999999999999996 | N24: 8.9600000000000009 | O24: 9.0999999999999996 | P24: 64.030000000000001 | Q24: 36369320 | R24: 2.29 | S24: 超市连锁 | T24: 福建 | U24: 1.54 | V24: 9.0299999999999994 | W24: 18718 | X24: 21569 | Y24: 0.87 | Z24: 120 | AA24: 52 | AB24: -0.02
A25: ="601999" -> 601999 | B25: 出版传媒 | C25: -0.79000000000000004 | D25: 8471 | E25: 34.43亿 | F25: 0.14999999999999999 | G25: 6.25 | H25: 6.25 | I25: 6.2599999999999998 | J25: 51 | K25: 0.81000000000000005 | L25: 6.2800000000000002 | M25: 6.2800000000000002 | N25: 6.2000000000000002 | O25: 6.2999999999999998 | P25: 21.289999999999999 | Q25: 5283141 | R25: 4.4400000000000004 | S25: 出版业 | T25: 辽宁 | U25: 1.27 | V25: 6.2400000000000002 | W25: 5230 | X25: 3241 | Y25: 1.6100000000000001 | Z25: 246 | AA25: 68 | AB25: -0.050000000000000003
A26: ="601989" -> 601989 | B26: 中国重工 | C26: 1.5800000000000001 | D26: 286643 | E26: 945.63亿 | F26: 0.16 | G26: 5.1500000000000004 | H26: 5.1500000000000004 | I26: 5.1600000000000001 | J26: 2354 | K26: 2.1800000000000002 | L26: 5.0800000000000001 | M26: 5.1699999999999999 | N26: 5.0300000000000002 | O26: 5.0700000000000003 | P26: 62.450000000000003 | Q26: 145603088 | R26: 4.9199999999999999 | S26: 船舶 | T26: 北京 | U26: 2.7599999999999998 | V26: 5.0800000000000001 | W26: 134580 | X26: 152063 | Y26: 0.89000000000000001 | Z26: 7 | AA26: 5684 | AB26: 0.080000000000000002
A27: ="600150" -> 600150 | B27: *ST船舶 | C27: -0.34999999999999998 | D27: 14276 | E27: 196.11亿 | F27: 0.10000000000000001 | G27: 14.23 | H27: 14.210000000000001 | I27: 14.23 | J27: 27 | K27: 0.64000000000000001 | L27: 14.35 | M27: 14.369999999999999 | N27: 14.1 | O27: 14.279999999999999 | P27: 47.490000000000002 | Q27: 20317548 | R27: 2.9100000000000001 | S27: 船舶 | T27: 上海 | U27: 1.8899999999999999 | V27: 14.23 | W27: 8358 | X27: 5918 | Y27: 1.4099999999999999 | Z27: 180 | AA27: 1 | AB27: -0.050000000000000003
A28: ="002414" -> 002414 | B28: 高德红外 | C28: -0.080000000000000002 | D28: 6873 | E28: 118.93亿 | F28: 0.14000000000000001 | G28: 24.98 | H28: 24.969999999999999 | I28: 24.98 | J28: 15 | K28: 0.47999999999999998 | L28: 25.050000000000001 | M28: 25.050000000000001 | N28: 24.510000000000002 | O28: 25 | P28: 120.81 | Q28: 17054706 | R28: 1.99 | S28: 电器仪表 | T28: 湖北 | U28: 2.1600000000000001 | V28: 24.809999999999999 | W28: 3612 | X28: 3260 | Y28: 1.1100000000000001 | Z28: 15 | AA28: 14 | AB28: -0.02
A29: ="002008" -> 002008 | B29: 大族激光 | C29: -0.25 | D29: 23332 | E29: 399.61亿 | F29: 0.23000000000000001 | G29: 40.229999999999997 | H29: 40.25 | I29: 40.259999999999998 | J29: 53 | K29: 0.57999999999999996 | L29: 40.399999999999999 | M29: 40.420000000000002 | N29: 39.740000000000002 | O29: 40.329999999999998 | P29: 19.43 | Q29: 93600656 | R29: 2.54 | S29: 电器仪表 | T29: 深圳 | U29: 1.69 | V29: 40.119999999999997 | W29: 11833 | X29: 11499 | Y29: 1.03 | Z29: 8 | AA29: 25 | AB29: -0.10000000000000001
A30: ="300012" -> 300012 | B30: 华测检测 | C30: -0.62 | D30: 26440 | E30: 121.13亿 | F30: 0.17999999999999999 | G30: 8.0500000000000007 | H30: 8.0500000000000007 | I30: 8.0600000000000005 | J30: 83 | K30: 0.5 | L30: 8.0999999999999996 | M30: 8.1300000000000008 | N30: 7.96 | O30: 8.0999999999999996 | P30: 61.969999999999999 | Q30: 21220686 | R30: 2.3399999999999999 | S30: 电器仪表 | T30: 深圳 | U30: 2.1000000000000001 | V30: 8.0299999999999994 | W30: 14385 | X30: 12054 | Y30: 1.19 | Z30: 398 | AA30: 14 | AB30: -0.050000000000000003
A31: ="002415" -> 002415 | B31: 海康威视 | C31: -1.3200000000000001 | D31: 72361 | E31: 2903.66亿 | F31: 0.089999999999999997 | G31: 35.960000000000001 | H31: 35.960000000000001 | I31: 36 | J31: 99 | K31: 0.67000000000000004 | L31: 36 | M31: 36.049999999999997 | N31: 35.530000000000001 | O31: 36.439999999999998 | P31: 34.090000000000003 | Q31: 259147664 | R31: 3.7799999999999998 | S31: 电器仪表 | T31: 浙江 | U31: 1.4299999999999999 | V31: 35.810000000000002 | W31: 39732 | X31: 32629 | Y31: 1.22 | Z31: 166 | AA31: 165 | AB31: -0.47999999999999998
A32: ="300066" -> 300066 | B32: 三川智慧 | C32: -2.8100000000000001 | D32: 50323 | E32: 44.72亿 | F32: 0.51000000000000001 | G32: 4.4900000000000002 | H32: 4.4900000000000002 | I32: 4.5 | J32: 103 | K32: 0.22 | L32: 4.6200000000000001 | M32: 4.6200000000000001 | N32: 4.46 | O32: 4.6200000000000001 | P32: 42.210000000000001 | Q32: 22696244 | R32: 1.71 | S32: 电器仪表 | T32: 江西 | U32: 3.46 | V32: 4.5099999999999998 | W32: 27973 | X32: 22350 | Y32: 1.25 | Z32: 58 | AA32: 249 | AB32: -0.13
A33: ="601700" -> 601700 | B33: 风范股份 | C33: 2.54 | D33: 381285 | E33: 123.52亿 | F33: 3.3599999999999999 | G33: 10.9 | H33: 10.9 | I33: 10.91 | J33: 5755 | K33: 9 | L33: 11.279999999999999 | M33: 11.630000000000001 | N33: 9.5700000000000003 | O33: 10.630000000000001 | P33: 231.63999999999999 | Q33: 410003552 | R33: 7.29 | S33: 电气设备 | T33: 江苏 | U33: 19.379999999999999 | V33: 10.75 | W33: 205036 | X33: 176249 | Y33: 1.1599999999999999 | Z33: 253 | AA33: 736 | AB33: 0.27000000000000002
A34: ="300001" -> 300001 | B34: 特锐德 | C34: -0.67000000000000004 | D34: 12475 | E34: 205.01亿 | F34: 0.13 | G34: 22.170000000000002 | H34: 22.149999999999999 | I34: 22.170000000000002 | J34: 20 | K34: 0.72999999999999998 | L34: 22 | M34: 22.260000000000002 | N34: 21.879999999999999 | O34: 22.32 | P34: 115.45999999999999 | Q34: 27475980 | R34: 1.9199999999999999 | S34: 电气设备 | T34: 山东 | U34: 1.7 | V34: 22.02 | W34: 4345 | X34: 8130 | Y34: 0.53000000000000003 | Z34: 122 | AA34: 197 | AB34: -0.14999999999999999
A35: ="300215" -> 300215 | B35: 电科院 | C35: -1.2 | D35: 11780 | E35: 39.96亿 | F35: 0.19 | G35: 6.5700000000000003 | H35: 6.5800000000000001 | I35: 6.5899999999999999 | J35: 38 | K35: 0.77000000000000002 | L35: 6.6699999999999999 | M35: 6.6799999999999997 | N35: 6.5 | O35: 6.6500000000000004 | P35: 40.689999999999998 | Q35: 7728685 | R35: 3.1499999999999999 | S35: 电气设备 | T35: 江苏 | U35: 2.71 | V35: 6.5599999999999996 | W35: 6068 | X35: 5712 | Y35: 1.0600000000000001 | Z35: 6 | AA35: 236 | AB35: -0.080000000000000002
A36: ="601877" -> 601877 | B36: 正泰电器 | C36: -1.3200000000000001 | D36: 26612 | E36: 455.32亿 | F36: 0.14999999999999999 | G36: 26.210000000000001 | H36: 26.190000000000001 | I36: 26.210000000000001 | J36: 214 | K36: -0.70999999999999996 | L36: 26.699999999999999 | M36: 26.789999999999999 | N36: 26.199999999999999 | O36: 26.559999999999999 | P36: 15.16 | Q36: 70359880 | R36: 3.9199999999999999 | S36: 电气设备 | T36: 浙江 | U36: 2.2200000000000002 | V36: 26.440000000000001 | W36: 15262 | X36: 11350 | Y36: 1.3400000000000001 | Z36: 1 | AA36: 0 | AB36: -0.34999999999999998
A37: ="002606" -> 002606 | B37: 大连电瓷 | C37: -1.4199999999999999 | D37: 43029 | E37: 28.11亿 | F37: 1.0700000000000001 | G37: 6.96 | H37: 6.96 | I37: 6.9699999999999998 | J37: 189 | K37: 0.42999999999999999 | L37: 7.0300000000000002 | M37: 7.0300000000000002 | N37: 6.9000000000000004 | O37: 7.0599999999999996 | P37: -- | Q37: 29906794 | R37: 3.3500000000000001 | S37: 电气设备 | T37: 辽宁 | U37: 1.8400000000000001 | V37: 6.9500000000000002 | W37: 26037 | X37: 16991 | Y37: 1.53 | Z37: 386 | AA37: 483 | AB37: -0.10000000000000001
A38: ="300265" -> 300265 | B38: 通光线缆 | C38: -2.6899999999999999 | D38: 26839 | E38: 34.11亿 | F38: 0.80000000000000004 | G38: 10.130000000000001 | H38: 10.130000000000001 | I38: 10.140000000000001 | J38: 20 | K38: 0.59999999999999998 | L38: 10.26 | M38: 10.26 | N38: 10.01 | O38: 10.41 | P38: 83.400000000000006 | Q38: 27084180 | R38: 3.5299999999999998 | S38: 电气设备 | T38: 江苏 | U38: 2.3999999999999999 | V38: 10.09 | W38: 14994 | X38: 11845 | Y38: 1.27 | Z38: 484 | AA38: 148 | AB38: -0.28000000000000003
A39: ="300308" -> 300308 | B39: 中际旭创 | C39: -2.9900000000000002 | D39: 15619 | E39: 123.14亿 | F39: 0.71999999999999997 | G39: 56.460000000000001 | H39: 56.399999999999999 | I39: 56.469999999999999 | J39: 18 | K39: 1 | L39: 57.100000000000001 | M39: 57.100000000000001 | N39: 55 | O39: 58.200000000000003 | P39: 41.82 | Q39: 87983080 | R39: 3.71 | S39: 电气设备 | T39: 山东 | U39: 3.6099999999999999 | V39: 56.329999999999998 | W39: 7431 | X39: 8187 | Y39: 0.91000000000000003 | Z39: 151 | AA39: 27 | AB39: -1.74
A40: ="002358" -> 002358 | B40: 森源电气 | C40: -7.5099999999999998 | D40: 195250 | E40: 159.23亿 | F40: 2.1400000000000001 | G40: 17.489999999999998 | H40: 17.5 | I40: 17.530000000000001 | J40: 913 | K40: -3.3100000000000001 | L40: 18.5 | M40: 18.5 | N40: 17.390000000000001 | O40: 18.91 | P40: 29.190000000000001 | Q40: 351344256 | R40: 6.9199999999999999 | S40: 电气设备 | T40: 河南 | U40: 5.8700000000000001 | V40: 17.989999999999998 | W40: 111071 | X40: 84178 | Y40: 1.3200000000000001 | Z40: 54 | AA40: 35 | AB40: -1.4199999999999999
A41: ="300383" -> 300383 | B41: 光环新网 | C41: -0.56999999999999995 | D41: 26130 | E41: 236.54亿 | F41: 0.19 | G41: 17.300000000000001 | H41: 17.289999999999999 | I41: 17.300000000000001 | J41: 147 | K41: 0.81999999999999995 | L41: 17.399999999999999 | M41: 17.399999999999999 | N41: 17 | O41: 17.399999999999999 | P41: 42.039999999999999 | Q41: 44930264 | R41: 2.7000000000000002 | S41: 电信运营 | T41: 北京 | U41: 2.2999999999999998 | V41: 17.190000000000001 | W41: 12937 | X41: 13193 | Y41: 0.97999999999999998 | Z41: 140 | AA41: 32 | AB41: -0.10000000000000001
A42: ="000987" -> 000987 | B42: 越秀金控 | C42: 1.1100000000000001 | D42: 42039 | E42: 59.00亿 | F42: 0.78000000000000003 | G42: 10.960000000000001 | H42: 10.949999999999999 | I42: 10.960000000000001 | J42: 179 | K42: 3.1000000000000001 | L42: 10.99 | M42: 11 | N42: 10.5 | O42: 10.84 | P42: 77.129999999999995 | Q42: 45204068 | R42: 4.5999999999999996 | S42: 多元金融 | T42: 广东 | U42: 4.6100000000000003 | V42: 10.75 | W42: 20500 | X42: 21538 | Y42: 0.94999999999999996 | Z42: 382 | AA42: 739 | AB42: 0.12
A43: ="600830" -> 600830 | B43: 香溢融通 | C43: -2.77 | D43: 76996 | E43: 30.26亿 | F43: 1.69 | G43: 6.6600000000000001 | H43: 6.6600000000000001 | I43: 6.6699999999999999 | J43: 188 | K43: 1.52 | L43: 6.75 | M43: 6.75 | N43: 6.5300000000000002 | O43: 6.8499999999999996 | P43: 76.540000000000006 | Q43: 51187152 | R43: 6.8600000000000003 | S43: 多元金融 | T43: 浙江 | U43: 3.21 | V43: 6.6500000000000004 | W43: 42421 | X43: 34575 | Y43: 1.23 | Z43: 467 | AA43: 245 | AB43: -0.19
A44: ="600302" -> 600302 | B44: 标准股份 | C44: -0.58999999999999997 | D44: 7189 | E44: 17.37亿 | F44: 0.20999999999999999 | G44: 5.0199999999999996 | H44: 5.0099999999999998 | I44: 5.0199999999999996 | J44: 2 | K44: 0 | L44: 5.0599999999999996 | M44: 5.1100000000000003 | N44: 4.9900000000000002 | O44: 5.0499999999999998 | P44: -- | Q44: 3610617 | R44: 4.25 | S44: 纺织机械 | T44: 陕西 | U44: 2.3799999999999999 | V44: 5.0199999999999996 | W44: 4453 | X44: 2736 | Y44: 1.6299999999999999 | Z44: 7 | AA44: 101 | AB44: -0.029999999999999999
A45: ="600843" -> 600843 | B45: 上工申贝 | C45: -0.90000000000000002 | D45: 6165 | E45: 23.58亿 | F45: 0.20000000000000001 | G45: 7.7400000000000002 | H45: 7.7400000000000002 | I45: 7.7599999999999998 | J45: 100 | K45: -0.38 | L45: 7.7999999999999998 | M45: 7.8099999999999996 | N45: 7.6900000000000004 | O45: 7.8099999999999996 | P45: 23.59 | Q45: 4771986 | R45: 4.7599999999999998 | S45: 纺织机械 | T45: 上海 | U45: 1.54 | V45: 7.7400000000000002 | W45: 3118 | X45: 3047 | Y45: 1.02 | Z45: 18 | AA45: 67 | AB45: -0.070000000000000007
A46: ="002291" -> 002291 | B46: 星期六 | C46: -0.95999999999999996 | D46: 4851 | E46: 20.47亿 | F46: 0.12 | G46: 5.1600000000000001 | H46: 5.1600000000000001 | I46: 5.1699999999999999 | J46: 1 | K46: 0 | L46: 5.2300000000000004 | M46: 5.2300000000000004 | N46: 5.1100000000000003 | O46: 5.21 | P46: 78.239999999999995 | Q46: 2501656 | R46: 2.7799999999999998 | S46: 服饰 | T46: 广东 | U46: 2.2999999999999998 | V46: 5.1600000000000001 | W46: 3742 | X46: 1109 | Y46: 3.3700000000000001 | Z46: 14 | AA46: 27 | AB46: -0.050000000000000003
A47: ="002478" -> 002478 | B47: 常宝股份 | C47: -1.4299999999999999 | D47: 7836 | E47: 32.65亿 | F47: 0.13 | G47: 5.5 | H47: 5.4900000000000002 | I47: 5.5 | J47: 256 | K47: -0.17000000000000001 | L47: 5.5800000000000001 | M47: 5.5800000000000001 | N47: 5.4299999999999997 | O47: 5.5800000000000001 | P47: 10.76 | Q47: 4318080 | R47: 3.1000000000000001 | S47: 钢加工 | T47: 江苏 | U47: 2.6899999999999999 | V47: 5.5099999999999998 | W47: 5647 | X47: 2189 | Y47: 2.5800000000000001 | Z47: 155 | AA47: 132 | AB47: -0.080000000000000002
A48: ="000582" -> 000582 | B48: 北部湾港 | C48: 0.12 | D48: 9986 | E48: 21.19亿 | F48: 0.38 | G48: 8.0500000000000007 | H48: 8.0500000000000007 | I48: 8.0700000000000003 | J48: 20 | K48: 0.5 | L48: 8.0999999999999996 | M48: 8.1099999999999994 | N48: 7.9800000000000004 | O48: 8.0399999999999991 | P48: 19.649999999999999 | Q48: 8036265 | R48: 4.2800000000000002 | S48: 港口 | T48: 广西 | U48: 1.6200000000000001 | V48: 8.0500000000000007 | W48: 4402 | X48: 5583 | Y48: 0.79000000000000004 | Z48: 155 | AA48: 50 | AB48: 0.01
A49: ="600386" -> 600386 | B49: 北巴传媒 | C49: -1.9099999999999999 | D49: 35756 | E49: 37.18亿 | F49: 0.44 | G49: 4.6100000000000003 | H49: 4.6100000000000003 | I49: 4.6200000000000001 | J49: 301 | K49: 0.88 | L49: 4.6399999999999997 | M49: 4.6500000000000004 | N49: 4.5499999999999998 | O49: 4.7000000000000002 | P49: 43.340000000000003 | Q49: 16417174 | R49: 2.3999999999999999 | S49: 公共交通 | T49: 北京 | U49: 2.1299999999999999 | V49: 4.5899999999999999 | W49: 17834 | X49: 17922 | Y49: 1 | Z49: 47 | AA49: 949 | AB49: -0.089999999999999997
A50: ="600031" -> 600031 | B50: 三一重工 | C50: 1.19 | D50: 121496 | E50: 857.82亿 | F50: 0.16 | G50: 11.050000000000001 | H50: 11.039999999999999 | I50: 11.050000000000001 | J50: 370 | K50: 1.47 | L50: 10.869999999999999 | M50: 11.09 | N50: 10.800000000000001 | O50: 10.92 | P50: 13.24 | Q50: 133055856 | R50: 3.0800000000000001 | S50: 工程机械 | T50: 北京 | U50: 2.6600000000000001 | V50: 10.949999999999999 | W50: 53437 | X50: 68059 | Y50: 0.79000000000000004 | Z50: 240 | AA50: 210 | AB50: 0.13
A51: ="601100" -> 601100 | B51: 恒立液压 | C51: 0.41999999999999998 | D51: 3691 | E51: 254.90亿 | F51: 0.040000000000000001 | G51: 28.899999999999999 | H51: 28.890000000000001 | I51: 28.899999999999999 | J51: 8 | K51: 0.34999999999999998 | L51: 29.300000000000001 | M51: 29.300000000000001 | N51: 28.600000000000001 | O51: 28.780000000000001 | P51: 26.57 | Q51: 10659236 | R51: 1.46 | S51: 工程机械 | T51: 江苏 | U51: 2.4300000000000002 | V51: 28.879999999999999 | W51: 1555 | X51: 2135 | Y51: 0.72999999999999998 | Z51: 11 | AA51: 20 | AB51: 0.12
A52: ="000680" -> 000680 | B52: 山推股份 | C52: -0.53000000000000003 | D52: 19791 | E52: 39.53亿 | F52: 0.19 | G52: 3.7400000000000002 | H52: 3.7400000000000002 | I52: 3.75 | J52: 20 | K52: 0.54000000000000004 | L52: 3.75 | M52: 3.75 | N52: 3.7000000000000002 | O52: 3.7599999999999998 | P52: 40.909999999999997 | Q52: 7370159 | R52: 3.1400000000000001 | S52: 工程机械 | T52: 山东 | U52: 1.3300000000000001 | V52: 3.7200000000000002 | W52: 11295 | X52: 8496 | Y52: 1.3300000000000001 | Z52: 446 | AA52: 761 | AB52: -0.02
A53: ="600761" -> 600761 | B53: 安徽合力 | C53: -0.87 | D53: 7253 | E53: 75.65亿 | F53: 0.10000000000000001 | G53: 10.220000000000001 | H53: 10.210000000000001 | I53: 10.220000000000001 | J53: 60 | K53: 0.20000000000000001 | L53: 10.32 | M53: 10.33 | N53: 10.17 | O53: 10.310000000000001 | P53: 12.76 | Q53: 7423756 | R53: 2.0699999999999998 | S53: 工程机械 | T53: 安徽 | U53: 1.55 | V53: 10.24 | W53: 5246 | X53: 2006 | Y53: 2.6200000000000001 | Z53: 272 | AA53: 81 | AB53: -0.089999999999999997
A54: ="002228" -> 002228 | B54: 合兴包装 | C54: -0.56999999999999995 | D54: 20005 | E54: 61.07亿 | F54: 0.17000000000000001 | G54: 5.2400000000000002 | H54: 5.2400000000000002 | I54: 5.25 | J54: 5 | K54: 0.77000000000000002 | L54: 5.2699999999999996 | M54: 5.2699999999999996 | N54: 5.1900000000000004 | O54: 5.2699999999999996 | P54: 9.5299999999999994 | Q54: 10451194 | R54: 2.8999999999999999 | S54: 广告包装 | T54: 福建 | U54: 1.52 | V54: 5.2199999999999998 | W54: 13173 | X54: 6832 | Y54: 1.9299999999999999 | Z54: 5 | AA54: 81 | AB54: -0.029999999999999999
A55: ="300057" -> 300057 | B55: 万顺股份 | C55: -1.8799999999999999 | D55: 47984 | E55: 28.40亿 | F55: 1.3200000000000001 | G55: 7.8099999999999996 | H55: 7.8099999999999996 | I55: 7.8300000000000001 | J55: 463 | K55: -0.12 | L55: 7.8099999999999996 | M55: 7.8799999999999999 | N55: 7.7699999999999996 | O55: 7.96 | P55: 41.920000000000002 | Q55: 37523056 | R55: 1.97 | S55: 广告包装 | T55: 广东 | U55: 1.3799999999999999 | V55: 7.8200000000000003 | W55: 26159 | X55: 21825 | Y55: 1.2 | Z55: 3186 | AA55: 168 | AB55: -0.14999999999999999
A56: ="600986" -> 600986 | B56: 科达股份 | C56: 3.3100000000000001 | D56: 170174 | E56: 71.35亿 | F56: 1.3400000000000001 | G56: 5.6100000000000003 | H56: 5.6100000000000003 | I56: 5.6299999999999999 | J56: 488 | K56: 4.6600000000000001 | L56: 5.5 | M56: 5.6299999999999999 | N56: 5.2999999999999998 | O56: 5.4299999999999997 | P56: 12.449999999999999 | Q56: 93101224 | R56: 8.2799999999999994 | S56: 互联网 | T56: 山东 | U56: 6.0800000000000001 | V56: 5.4699999999999998 | W56: 86781 | X56: 83393 | Y56: 1.04 | Z56: 443 | AA56: 55 | AB56: 0.17999999999999999
A57: ="002341" -> 002341 | B57: 新纶科技 | C57: 0.56000000000000005 | D57: 114115 | E57: 78.09亿 | F57: 1.8300000000000001 | G57: 12.49 | H57: 12.49 | I57: 12.5 | J57: 674 | K57: 0.89000000000000001 | L57: 12.5 | M57: 12.65 | N57: 12.300000000000001 | O57: 12.42 | P57: 35.240000000000002 | Q57: 142252400 | R57: 4.2000000000000002 | S57: 化工原料 | T57: 深圳 | U57: 2.8199999999999998 | V57: 12.470000000000001 | W57: 65057 | X57: 49058 | Y57: 1.3300000000000001 | Z57: 23 | AA57: 895 | AB57: 0.070000000000000007
A58: ="600273" -> 600273 | B58: 嘉化能源 | C58: 0.51000000000000001 | D58: 33368 | E58: 139.25亿 | F58: 0.23999999999999999 | G58: 9.8499999999999996 | H58: 9.8100000000000005 | I58: 9.8399999999999999 | J58: 655 | K58: 1.44 | L58: 9.8000000000000007 | M58: 9.8499999999999996 | N58: 9.6899999999999995 | O58: 9.8000000000000007 | P58: 12.380000000000001 | Q58: 32583080 | R58: 4.7999999999999998 | S58: 化工原料 | T58: 浙江 | U58: 1.6299999999999999 | V58: 9.7599999999999998 | W58: 18420 | X58: 14947 | Y58: 1.23 | Z58: 92 | AA58: 33 | AB58: 0.050000000000000003
A59: ="600378" -> 600378 | B59: 天科股份 | C59: -0.39000000000000001 | D59: 2259 | E59: 30.31亿 | F59: 0.080000000000000002 | G59: 10.199999999999999 | H59: 10.199999999999999 | I59: 10.220000000000001 | J59: 42 | K59: 0.68999999999999995 | L59: 10.289999999999999 | M59: 10.310000000000001 | N59: 10.119999999999999 | O59: 10.24 | P59: 161 | Q59: 2307764 | R59: 3.3500000000000001 | S59: 化工原料 | T59: 四川 | U59: 1.8600000000000001 | V59: 10.220000000000001 | W59: 1496 | X59: 763 | Y59: 1.96 | Z59: 40 | AA59: 28 | AB59: -0.040000000000000001
A60: ="002165" -> 002165 | B60: 红 宝 丽 | C60: -1.0800000000000001 | D60: 8127 | E60: 24.05亿 | F60: 0.14999999999999999 | G60: 4.5599999999999996 | H60: 4.5499999999999998 | I60: 4.5599999999999996 | J60: 13 | K60: -0.42999999999999999 | L60: 4.6100000000000003 | M60: 4.6399999999999997 | N60: 4.54 | O60: 4.6100000000000003 | P60: 83.930000000000007 | Q60: 3723594 | R60: 2.0099999999999998 | S60: 化工原料 | T60: 江苏 | U60: 2.1699999999999999 | V60: 4.5800000000000001 | W60: 5595 | X60: 2532 | Y60: 2.21 | Z60: 446 | AA60: 259 | AB60: -0.050000000000000003
A61: ="300082" -> 300082 | B61: 奥克股份 | C61: -1.1799999999999999 | D61: 5584 | E61: 45.14亿 | F61: 0.080000000000000002 | G61: 6.6900000000000004 | H61: 6.6799999999999997 | I61: 6.6900000000000004 | J61: 1 | K61: 0 | L61: 6.7300000000000004 | M61: 6.7300000000000004 | N61: 6.6600000000000001 | O61: 6.7699999999999996 | P61: 13.529999999999999 | Q61: 3736364 | R61: 2.6499999999999999 | S61: 化工原料 | T61: 辽宁 | U61: 1.03 | V61: 6.6900000000000004 | W61: 3146 | X61: 2438 | Y61: 1.29 | Z61: 256 | AA61: 65 | AB61: -0.080000000000000002
A62: ="600346" -> 600346 | B62: 恒力股份 | C62: 0 | D62: 9753 | E62: 139.28亿 | F62: 0.11 | G62: 15.15 | H62: 15.109999999999999 | I62: 15.130000000000001 | J62: 100 | K62: 0.72999999999999998 | L62: 15.15 | M62: 15.18 | N62: 14.970000000000001 | O62: 15.15 | P62: 15.720000000000001 | Q62: 14688785 | R62: 2.5 | S62: 化纤 | T62: 辽宁 | U62: 1.3899999999999999 | V62: 15.060000000000001 | W62: 4664 | X62: 5088 | Y62: 0.92000000000000004 | Z62: 7 | AA62: 50 | AB62: 0
A63: ="002493" -> 002493 | B63: 荣盛石化 | C63: -0.53000000000000003 | D63: 8641 | E63: 602.74亿 | F63: 0.02 | G63: 11.359999999999999 | H63: 11.35 | I63: 11.359999999999999 | J63: 24 | K63: 0.089999999999999997 | L63: 11.460000000000001 | M63: 11.48 | N63: 11.32 | O63: 11.42 | P63: 30.300000000000001 | Q63: 9838212 | R63: 3.3799999999999999 | S63: 化纤 | T63: 浙江 | U63: 1.3999999999999999 | V63: 11.390000000000001 | W63: 3368 | X63: 5272 | Y63: 0.64000000000000001 | Z63: 251 | AA63: 25 | AB63: -0.059999999999999998
A64: ="002427" -> 002427 | B64: *ST尤夫 | C64: -0.67000000000000004 | D64: 4770 | E64: 51.12亿 | F64: 0.12 | G64: 13.289999999999999 | H64: 13.25 | I64: 13.27 | J64: 38 | K64: 0.98999999999999999 | L64: 13.300000000000001 | M64: 13.34 | N64: 13.1 | O64: 13.380000000000001 | P64: 263.81999999999999 | Q64: 6292860 | R64: 3.8700000000000001 | S64: 化纤 | T64: 浙江 | U64: 1.79 | V64: 13.19 | W64: 2522 | X64: 2248 | Y64: 1.1200000000000001 | Z64: 235 | AA64: 32 | AB64: -0.089999999999999997
A65: ="002001" -> 002001 | B65: 新 和 成 | C65: 1.3899999999999999 | D65: 39099 | E65: 371.05亿 | F65: 0.17999999999999999 | G65: 17.489999999999998 | H65: 17.469999999999999 | I65: 17.489999999999998 | J65: 169 | K65: 2.2799999999999998 | L65: 17.260000000000002 | M65: 17.510000000000002 | N65: 17.010000000000002 | O65: 17.25 | P65: 11.109999999999999 | Q65: 67405288 | R65: 3.6200000000000001 | S65: 化学制药 | T65: 浙江 | U65: 2.8999999999999999 | V65: 17.239999999999998 | W65: 16083 | X65: 23015 | Y65: 0.69999999999999996 | Z65: 580 | AA65: 623 | AB65: 0.23999999999999999
A66: ="600276" -> 600276 | B66: 恒瑞医药 | C66: -0.34000000000000002 | D66: 32845 | E66: 2505.46亿 | F66: 0.089999999999999997 | G66: 68.269999999999996 | H66: 68.260000000000005 | I66: 68.269999999999996 | J66: 57 | K66: 0.70999999999999996 | L66: 67.689999999999998 | M66: 68.5 | N66: 67.310000000000002 | O66: 68.5 | P66: 61.890000000000001 | Q66: 222492160 | R66: 4.3399999999999999 | S66: 化学制药 | T66: 江苏 | U66: 1.74 | V66: 67.739999999999995 | W66: 16887 | X66: 15957 | Y66: 1.0600000000000001 | Z66: 1 | AA66: 0 | AB66: -0.23000000000000001
A67: ="000739" -> 000739 | B67: 普洛药业 | C67: -0.56999999999999995 | D67: 8714 | E67: 100.58亿 | F67: 0.080000000000000002 | G67: 8.7699999999999996 | H67: 8.7699999999999996 | I67: 8.7799999999999994 | J67: 14 | K67: 0.34000000000000002 | L67: 8.7799999999999994 | M67: 8.8000000000000007 | N67: 8.6600000000000001 | O67: 8.8200000000000003 | P67: 28.350000000000001 | Q67: 7606893 | R67: 2.8700000000000001 | S67: 化学制药 | T67: 浙江 | U67: 1.5900000000000001 | V67: 8.7300000000000004 | W67: 4914 | X67: 3800 | Y67: 1.29 | Z67: 83 | AA67: 90 | AB67: -0.050000000000000003
A68: ="300233" -> 300233 | B68: 金城医药 | C68: -1.8300000000000001 | D68: 2954 | E68: 53.40亿 | F68: 0.080000000000000002 | G68: 15.039999999999999 | H68: 15.060000000000001 | I68: 15.1 | J68: 3 | K68: 0.27000000000000002 | L68: 15.32 | M68: 15.359999999999999 | N68: 14.970000000000001 | O68: 15.32 | P68: 18.870000000000001 | Q68: 4470686 | R68: 4.7599999999999998 | S68: 化学制药 | T68: 山东 | U68: 2.5499999999999998 | V68: 15.130000000000001 | W68: 2068 | X68: 886 | Y68: 2.3300000000000001 | Z68: 40 | AA68: 13 | AB68: -0.28000000000000003
A69: ="002616" -> 002616 | B69: 长青集团 | C69: -0.26000000000000001 | D69: 5623 | E69: 35.10亿 | F69: 0.12 | G69: 7.6399999999999997 | H69: 7.6399999999999997 | I69: 7.6500000000000004 | J69: 4 | K69: 0.92000000000000004 | L69: 7.6399999999999997 | M69: 7.6500000000000004 | N69: 7.54 | O69: 7.6600000000000001 | P69: 43.75 | Q69: 4258213 | R69: 2.5800000000000001 | S69: 环境保护 | T69: 广东 | U69: 1.44 | V69: 7.5700000000000003 | W69: 2845 | X69: 2777 | Y69: 1.02 | Z69: 36 | AA69: 82 | AB69: -0.02
A70: ="002658" -> 002658 | B70: 雪迪龙 | C70: -0.51000000000000001 | D70: 5457 | E70: 24.01亿 | F70: 0.17999999999999999 | G70: 7.8799999999999999 | H70: 7.8799999999999999 | I70: 7.8899999999999997 | J70: 3 | K70: 0.64000000000000001 | L70: 7.8899999999999997 | M70: 7.9400000000000004 | N70: 7.7999999999999998 | O70: 7.9199999999999999 | P70: 25.620000000000001 | Q70: 4285525 | R70: 3.48 | S70: 环境保护 | T70: 北京 | U70: 1.77 | V70: 7.8499999999999996 | W70: 3356 | X70: 2101 | Y70: 1.6000000000000001 | Z70: 13 | AA70: 66 | AB70: -0.040000000000000001
A71: ="002200" -> 002200 | B71: 云投生态 | C71: -0.63 | D71: 4335 | E71: 8.24亿 | F71: 0.33000000000000002 | G71: 6.2599999999999998 | H71: 6.2599999999999998 | I71: 6.2699999999999996 | J71: 4 | K71: 1.29 | L71: 6.3399999999999999 | M71: 6.3499999999999996 | N71: 6.1200000000000001 | O71: 6.2999999999999998 | P71: -- | Q71: 2697518 | R71: 4.2300000000000004 | S71: 环境保护 | T71: 云南 | U71: 3.6499999999999999 | V71: 6.2199999999999998 | W71: 2786 | X71: 1549 | Y71: 1.8 | Z71: 39 | AA71: 46 | AB71: -0.040000000000000001
A72: ="300056" -> 300056 | B72: 三维丝 | C72: -1.3300000000000001 | D72: 8188 | E72: 12.78亿 | F72: 0.38 | G72: 5.9199999999999999 | H72: 5.9000000000000004 | I72: 5.9199999999999999 | J72: 36 | K72: 1.54 | L72: 6.0099999999999998 | M72: 6.0099999999999998 | N72: 5.8099999999999996 | O72: 6 | P72: -- | Q72: 4840234 | R72: 2.6600000000000001 | S72: 环境保护 | T72: 福建 | U72: 3.3300000000000001 | V72: 5.9100000000000001 | W72: 5098 | X72: 3090 | Y72: 1.6499999999999999 | Z72: 118 | AA72: 4 | AB72: -0.080000000000000002
A73: ="600766" -> 600766 | B73: 园城黄金 | C73: 1.69 | D73: 48489 | E73: 20.24亿 | F73: 2.1699999999999999 | G73: 9.0399999999999991 | H73: 9.0299999999999994 | I73: 9.0399999999999991 | J73: 162 | K73: 0.56000000000000005 | L73: 8.8200000000000003 | M73: 9.0999999999999996 | N73: 8.7899999999999991 | O73: 8.8900000000000006 | P73: 2372.8099999999999 | Q73: 43512488 | R73: 3.8100000000000001 | S73: 黄金 | T73: 山东 | U73: 3.4900000000000002 | V73: 8.9700000000000006 | W73: 20368 | X73: 28121 | Y73: 0.71999999999999997 | Z73: 210 | AA73: 362 | AB73: 0.14999999999999999
A74: ="600547" -> 600547 | B74: 山东黄金 | C74: 0.62 | D74: 35181 | E74: 496.41亿 | F74: 0.23999999999999999 | G74: 34.200000000000003 | H74: 34.189999999999998 | I74: 34.200000000000003 | J74: 212 | K74: 0.26000000000000001 | L74: 33.619999999999997 | M74: 34.299999999999997 | N74: 33.609999999999999 | O74: 33.990000000000002 | P74: 73.739999999999995 | Q74: 119603792 | R74: 3.3599999999999999 | S74: 黄金 | T74: 山东 | U74: 2.0299999999999998 | V74: 34 | W74: 12519 | X74: 22661 | Y74: 0.55000000000000004 | Z74: 176 | AA74: 61 | AB74: 0.20999999999999999
A75: ="600509" -> 600509 | B75: 天富能源 | C75: 9.9199999999999999 | D75: 28034 | E75: 48.18亿 | F75: 0.31 | G75: 5.3200000000000003 | H75: 5.3200000000000003 | I75: -- | J75: 20 | K75: 0 | L75: 5.3200000000000003 | M75: 5.3200000000000003 | N75: 5.3200000000000003 | O75: 4.8399999999999999 | P75: 71.040000000000006 | Q75: 14914088 | R75: 6.9699999999999998 | S75: 火力发电 | T75: 新疆 | U75: 0 | V75: 5.3200000000000003 | W75: 22872 | X75: 5162 | Y75: 4.4299999999999997 | Z75: 116419 | AA75: 0 | AB75: 0.47999999999999998
A76: ="000720" -> 000720 | B76: *ST新能 | C76: 2.0499999999999998 | D76: 14519 | E76: 38.68亿 | F76: 0.17000000000000001 | G76: 4.4800000000000004 | H76: 4.4699999999999998 | I76: 4.4800000000000004 | J76: 330 | K76: 3.23 | L76: 4.3899999999999997 | M76: 4.4900000000000002 | N76: 4.3300000000000001 | O76: 4.3899999999999997 | P76: 7.7999999999999998 | Q76: 6388969 | R76: 3.7999999999999998 | S76: 火力发电 | T76: 山东 | U76: 3.6400000000000001 | V76: 4.4000000000000004 | W76: 5835 | X76: 8684 | Y76: 0.67000000000000004 | Z76: 96 | AA76: 110 | AB76: 0.089999999999999997
A77: ="600021" -> 600021 | B77: 上海电力 | C77: -0.77000000000000002 | D77: 11509 | E77: 76.86亿 | F77: 0.13 | G77: 8.9800000000000004 | H77: 8.9700000000000006 | I77: 8.9800000000000004 | J77: 22 | K77: 0.22 | L77: 9.0500000000000007 | M77: 9.0500000000000007 | N77: 8.9499999999999993 | O77: 9.0500000000000007 | P77: 24.699999999999999 | Q77: 10343364 | R77: 3.3599999999999999 | S77: 火力发电 | T77: 上海 | U77: 1.1000000000000001 | V77: 8.9900000000000002 | W77: 5349 | X77: 6160 | Y77: 0.87 | Z77: 52 | AA77: 567 | AB77: -0.070000000000000007
A78: ="000531" -> 000531 | B78: 穗恒运Ａ | C78: -4.7999999999999998 | D78: 80707 | E78: 54.33亿 | F78: 1.1799999999999999 | G78: 7.9299999999999997 | H78: 7.9299999999999997 | I78: 7.9500000000000002 | J78: 356 | K78: 0.38 | L78: 8.1300000000000008 | M78: 8.1400000000000006 | N78: 7.8700000000000001 | O78: 8.3300000000000001 | P78: 55.909999999999997 | Q78: 64624388 | R78: 4.3700000000000001 | S78: 火力发电 | T78: 广东 | U78: 3.2400000000000002 | V78: 8.0099999999999998 | W78: 49825 | X78: 30882 | Y78: 1.6100000000000001 | Z78: 733 | AA78: 396 | AB78: -0.40000000000000002
A79: ="600897" -> 600897 | B79: 厦门空港 | C79: -0.56000000000000005 | D79: 1642 | E79: 68.47亿 | F79: 0.059999999999999998 | G79: 22.989999999999998 | H79: 23.010000000000002 | I79: 23.050000000000001 | J79: 23 | K79: 0.22 | L79: 23.109999999999999 | M79: 23.109999999999999 | N79: 22.920000000000002 | O79: 23.120000000000001 | P79: 13.52 | Q79: 3775434 | R79: 2.1200000000000001 | S79: 机场 | T79: 福建 | U79: 0.81999999999999995 | V79: 22.989999999999998 | W79: 843 | X79: 799 | Y79: 1.0600000000000001 | Z79: 4 | AA79: 10 | AB79: -0.13
A80: ="600009" -> 600009 | B80: 上海机场 | C80: -2.0699999999999998 | D80: 10705 | E80: 636.62亿 | F80: 0.10000000000000001 | G80: 58.219999999999999 | H80: 58.219999999999999 | I80: 58.229999999999997 | J80: 30 | K80: 0.58999999999999997 | L80: 58.799999999999997 | M80: 58.799999999999997 | N80: 57.32 | O80: 59.450000000000003 | P80: 26.789999999999999 | Q80: 62069940 | R80: 3.3500000000000001 | S80: 机场 | T80: 上海 | U80: 2.4900000000000002 | V80: 57.979999999999997 | W80: 5914 | X80: 4791 | Y80: 1.23 | Z80: 1 | AA80: 1 | AB80: -1.23
A81: ="002520" -> 002520 | B81: 日发精机 | C81: -0.13 | D81: 5763 | E81: 18.48亿 | F81: 0.23999999999999999 | G81: 7.8300000000000001 | H81: 7.8300000000000001 | I81: 7.8399999999999999 | J81: 2 | K81: 1.29 | L81: 7.8899999999999997 | M81: 7.8899999999999997 | N81: 7.7000000000000002 | O81: 7.8399999999999999 | P81: 70.700000000000003 | Q81: 4468541 | R81: 3.5800000000000001 | S81: 机床制造 | T81: 浙江 | U81: 2.4199999999999999 | V81: 7.75 | W81: 3301 | X81: 2462 | Y81: 1.3400000000000001 | Z81: 8 | AA81: 14 | AB81: -0.01
A82: ="002150" -> 002150 | B82: 通润装备 | C82: 2.1099999999999999 | D82: 9220 | E82: 21.28亿 | F82: 0.34000000000000002 | G82: 7.7599999999999998 | H82: 7.75 | I82: 7.7599999999999998 | J82: 5 | K82: 1.1699999999999999 | L82: 7.6799999999999997 | M82: 7.7599999999999998 | N82: 7.6399999999999997 | O82: 7.5999999999999996 | P82: 17.370000000000001 | Q82: 7088321 | R82: 6.3200000000000003 | S82: 机械基件 | T82: 江苏 | U82: 1.5800000000000001 | V82: 7.6900000000000004 | W82: 5115 | X82: 4104 | Y82: 1.25 | Z82: 196 | AA82: 16 | AB82: 0.16
A83: ="002552" -> 002552 | B83: *ST宝鼎 | C83: -0.40000000000000002 | D83: 3283 | E83: 14.95亿 | F83: 0.16 | G83: 7.4699999999999998 | H83: 7.46 | I83: 7.4699999999999998 | J83: 50 | K83: 0 | L83: 7.4000000000000004 | M83: 7.5800000000000001 | N83: 7.3300000000000001 | O83: 7.5 | P83: 79.730000000000004 | Q83: 2443940 | R83: 1.3500000000000001 | S83: 机械基件 | T83: 浙江 | U83: 3.3300000000000001 | V83: 7.4400000000000004 | W83: 1435 | X83: 1848 | Y83: 0.78000000000000003 | Z83: 13 | AA83: 32 | AB83: -0.029999999999999999
A84: ="600421" -> 600421 | B84: ST仰帆 | C84: -0.91000000000000003 | D84: 431 | E84: 17.11亿 | F84: 0.02 | G84: 8.75 | H84: 8.7300000000000004 | I84: 8.75 | J84: 18 | K84: 0.56999999999999995 | L84: 8.8300000000000001 | M84: 8.8599999999999994 | N84: 8.6899999999999995 | O84: 8.8300000000000001 | P84: -- | Q84: 376148 | R84: 2.1800000000000002 | S84: 机械基件 | T84: 湖北 | U84: 1.9299999999999999 | V84: 8.7300000000000004 | W84: 336 | X84: 95 | Y84: 3.54 | Z84: 6 | AA84: 7 | AB84: -0.080000000000000002
A85: ="600592" -> 600592 | B85: 龙溪股份 | C85: -1 | D85: 17929 | E85: 27.65亿 | F85: 0.45000000000000001 | G85: 6.9199999999999999 | H85: 6.9199999999999999 | I85: 6.9400000000000004 | J85: 25 | K85: 0.57999999999999996 | L85: 6.9500000000000002 | M85: 6.96 | N85: 6.8700000000000001 | O85: 6.9900000000000002 | P85: 24.670000000000002 | Q85: 12376360 | R85: 2.3500000000000001 | S85: 机械基件 | T85: 福建 | U85: 1.29 | V85: 6.9000000000000004 | W85: 10160 | X85: 7769 | Y85: 1.3100000000000001 | Z85: 26 | AA85: 100 | AB85: -0.070000000000000007
A86: ="000678" -> 000678 | B86: 襄阳轴承 | C86: -1.0600000000000001 | D86: 2435 | E86: 28.15亿 | F86: 0.059999999999999998 | G86: 6.5599999999999996 | H86: 6.5599999999999996 | I86: 6.5700000000000003 | J86: 112 | K86: 0 | L86: 6.6299999999999999 | M86: 6.6500000000000004 | N86: 6.5 | O86: 6.6299999999999999 | P86: -- | Q86: 1595334 | R86: 1.19 | S86: 机械基件 | T86: 湖北 | U86: 2.2599999999999998 | V86: 6.5499999999999998 | W86: 1139 | X86: 1296 | Y86: 0.88 | Z86: 385 | AA86: 2 | AB86: -0.070000000000000007
A87: ="601177" -> 601177 | B87: 杭齿前进 | C87: -1.5 | D87: 2546 | E87: 50.05亿 | F87: 0.059999999999999998 | G87: 12.51 | H87: 12.51 | I87: 12.550000000000001 | J87: 22 | K87: 0.81000000000000005 | L87: 12.6 | M87: 12.66 | N87: 12.33 | O87: 12.699999999999999 | P87: 337.22000000000003 | Q87: 3178723 | R87: 1.6399999999999999 | S87: 机械基件 | T87: 浙江 | U87: 2.6000000000000001 | V87: 12.49 | W87: 1321 | X87: 1225 | Y87: 1.0800000000000001 | Z87: 354 | AA87: 10 | AB87: -0.19
A88: ="002242" -> 002242 | B88: 九阳股份 | C88: 5.6100000000000003 | D88: 30212 | E88: 139.13亿 | F88: 0.40000000000000002 | G88: 18.260000000000002 | H88: 18.25 | I88: 18.260000000000002 | J88: 168 | K88: 2.8700000000000001 | L88: 17.579999999999998 | M88: 18.370000000000001 | N88: 17.579999999999998 | O88: 17.289999999999999 | P88: 18.469999999999999 | Q88: 53895124 | R88: 11.99 | S88: 家用电器 | T88: 山东 | U88: 4.5700000000000003 | V88: 17.84 | W88: 12587 | X88: 17624 | Y88: 0.70999999999999996 | Z88: 317 | AA88: 154 | AB88: 0.96999999999999997
A89: ="002032" -> 002032 | B89: 苏 泊 尔 | C89: 5.2300000000000004 | D89: 6110 | E89: 337.29亿 | F89: 0.11 | G89: 61.93 | H89: 61.93 | I89: 61.969999999999999 | J89: 9 | K89: -1.0800000000000001 | L89: 59.5 | M89: 64 | N89: 59 | O89: 58.850000000000001 | P89: 34.539999999999999 | Q89: 37643636 | R89: 6.8600000000000003 | S89: 家用电器 | T89: 浙江 | U89: 8.5 | V89: 61.609999999999999 | W89: 3361 | X89: 2748 | Y89: 1.22 | Z89: 7 | AA89: 4 | AB89: 3.0800000000000001
A90: ="000521" -> 000521 | B90: 长虹美菱 | C90: 1.94 | D90: 43897 | E90: 29.53亿 | F90: 0.55000000000000004 | G90: 3.6800000000000002 | H90: 3.6699999999999999 | I90: 3.6800000000000002 | J90: 104 | K90: 1.1000000000000001 | L90: 3.6600000000000001 | M90: 3.7000000000000002 | N90: 3.6299999999999999 | O90: 3.6099999999999999 | P90: 43.920000000000002 | Q90: 16110153 | R90: 5.2300000000000004 | S90: 家用电器 | T90: 安徽 | U90: 1.94 | V90: 3.6699999999999999 | W90: 22835 | X90: 21061 | Y90: 1.0800000000000001 | Z90: 1813 | AA90: 127 | AB90: 0.070000000000000007
A91: ="600690" -> 600690 | B91: 青岛海尔 | C91: 0.12 | D91: 51863 | E91: 1019.49亿 | F91: 0.089999999999999997 | G91: 16.719999999999999 | H91: 16.699999999999999 | I91: 16.719999999999999 | J91: 170 | K91: 0.91000000000000003 | L91: 16.68 | M91: 16.75 | N91: 16.52 | O91: 16.699999999999999 | P91: 13.029999999999999 | Q91: 86142464 | R91: 3.4900000000000002 | S91: 家用电器 | T91: 山东 | U91: 1.3799999999999999 | V91: 16.609999999999999 | W91: 23741 | X91: 28121 | Y91: 0.83999999999999997 | Z91: 859 | AA91: 14 | AB91: 0.02
A92: ="000651" -> 000651 | B92: 格力电器 | C92: -1 | D92: 76688 | E92: 2723.43亿 | F92: 0.13 | G92: 45.619999999999997 | H92: 45.609999999999999 | I92: 45.619999999999997 | J92: 64 | K92: 0.59999999999999998 | L92: 46.020000000000003 | M92: 46.020000000000003 | N92: 45.240000000000002 | O92: 46.079999999999998 | P92: 9.75 | Q92: 349375232 | R92: 3.79 | S92: 家用电器 | T92: 广东 | U92: 1.69 | V92: 45.560000000000002 | W92: 40992 | X92: 35696 | Y92: 1.1499999999999999 | Z92: 74 | AA92: 14 | AB92: -0.46000000000000002
A93: ="000418" -> 000418 | B93: 小天鹅Ａ | C93: -1.28 | D93: 2586 | E93: 246.83亿 | F93: 0.059999999999999998 | G93: 56.18 | H93: 56.18 | I93: 56.219999999999999 | J93: 7 | K93: 0.32000000000000001 | L93: 56.280000000000001 | M93: 56.280000000000001 | N93: 55.619999999999997 | O93: 56.909999999999997 | P93: 19.780000000000001 | Q93: 14495458 | R93: 1.8500000000000001 | S93: 家用电器 | T93: 江苏 | U93: 1.1599999999999999 | V93: 56.049999999999997 | W93: 1226 | X93: 1360 | Y93: 0.90000000000000002 | Z93: 4 | AA93: 5 | AB93: -0.72999999999999998
A94: ="000333" -> 000333 | B94: 美的集团 | C94: -1.46 | D94: 60894 | E94: 3116.92亿 | F94: 0.089999999999999997 | G94: 48.450000000000003 | H94: 48.439999999999998 | I94: 48.450000000000003 | J94: 121 | K94: 0.64000000000000001 | L94: 48.350000000000001 | M94: 48.600000000000001 | N94: 48 | O94: 49.170000000000002 | P94: 13.35 | Q94: 294010368 | R94: 3.7999999999999998 | S94: 家用电器 | T94: 广东 | U94: 1.22 | V94: 48.280000000000001 | W94: 30240 | X94: 30654 | Y94: 0.98999999999999999 | Z94: 1 | AA94: 168 | AB94: -0.71999999999999997
A95: ="002705" -> 002705 | B95: 新宝股份 | C95: -2.1000000000000001 | D95: 2924 | E95: 85.35亿 | F95: 0.040000000000000001 | G95: 10.720000000000001 | H95: 10.720000000000001 | I95: 10.73 | J95: 15 | K95: 0.56000000000000005 | L95: 10.91 | M95: 10.93 | N95: 10.619999999999999 | O95: 10.949999999999999 | P95: 17.989999999999998 | Q95: 3135159 | R95: 3.1899999999999999 | S95: 家用电器 | T95: 广东 | U95: 2.8300000000000001 | V95: 10.720000000000001 | W95: 1454 | X95: 1470 | Y95: 0.98999999999999999 | Z95: 41 | AA95: 3 | AB95: -0.23000000000000001
A96: ="002663" -> 002663 | B96: 普邦股份 | C96: 9.8699999999999992 | D96: 73424 | E96: 43.12亿 | F96: 0.58999999999999997 | G96: 3.4500000000000002 | H96: 3.4500000000000002 | I96: -- | J96: 100 | K96: 0 | L96: 3.4500000000000002 | M96: 3.4500000000000002 | N96: 3.4500000000000002 | O96: 3.1400000000000001 | P96: 33.43 | Q96: 25331186 | R96: 6.6399999999999997 | S96: 建筑工程 | T96: 广东 | U96: 0 | V96: 3.4500000000000002 | W96: 57916 | X96: 15507 | Y96: 3.73 | Z96: 431764 | AA96: 0 | AB96: 0.31
A97: ="600528" -> 600528 | B97: 中铁工业 | C97: 0.94999999999999996 | D97: 46361 | E97: 215.02亿 | F97: 0.25 | G97: 11.699999999999999 | H97: 11.699999999999999 | I97: 11.710000000000001 | J97: 547 | K97: 1.3899999999999999 | L97: 11.5 | M97: 11.75 | N97: 11.48 | O97: 11.59 | P97: 18.050000000000001 | Q97: 53815160 | R97: 5.6900000000000004 | S97: 建筑工程 | T97: 四川 | U97: 2.3300000000000001 | V97: 11.609999999999999 | W97: 23702 | X97: 22658 | Y97: 1.05 | Z97: 253 | AA97: 251 | AB97: 0.11
A98: ="300284" -> 300284 | B98: 苏交科 | C98: 0.81000000000000005 | D98: 32046 | E98: 61.11亿 | F98: 0.58999999999999997 | G98: 11.23 | H98: 11.220000000000001 | I98: 11.23 | J98: 23 | K98: -0.080000000000000002 | L98: 11.300000000000001 | M98: 11.4 | N98: 11.16 | O98: 11.140000000000001 | P98: 18.629999999999999 | Q98: 36157420 | R98: 5.9299999999999997 | S98: 建筑工程 | T98: 江苏 | U98: 2.1499999999999999 | V98: 11.279999999999999 | W98: 18074 | X98: 13971 | Y98: 1.29 | Z98: 356 | AA98: 71 | AB98: 0.089999999999999997
A99: ="601186" -> 601186 | B99: 中国铁建 | C99: -0.17999999999999999 | D99: 206285 | E99: 1305.62亿 | F99: 0.17999999999999999 | G99: 11.35 | H99: 11.35 | I99: 11.359999999999999 | J99: 1008 | K99: 0.53000000000000003 | L99: 11.369999999999999 | M99: 11.369999999999999 | N99: 11.109999999999999 | O99: 11.369999999999999 | P99: 9.1400000000000006 | Q99: 232743232 | R99: 4.7699999999999996 | S99: 建筑工程 | T99: 北京 | U99: 2.29 | V99: 11.279999999999999 | W99: 102207 | X99: 104078 | Y99: 0.97999999999999998 | Z99: 647 | AA99: 101 | AB99: -0.02
A100: ="002116" -> 002116 | B100: 中国海诚 | C100: -0.40999999999999998 | D100: 10485 | E100: 40.19亿 | F100: 0.25 | G100: 9.6799999999999997 | H100: 9.5999999999999996 | I100: 9.6799999999999997 | J100: 33 | K100: 1.5700000000000001 | L100: 9.6799999999999997 | M100: 9.6899999999999995 | N100: 9.4499999999999993 | O100: 9.7200000000000006 | P100: 20.399999999999999 | Q100: 10012327 | R100: 1.5900000000000001 | S100: 建筑工程 | T100: 上海 | U100: 2.4700000000000002 | V100: 9.5500000000000007 | W100: 5637 | X100: 4848 | Y100: 1.1599999999999999 | Z100: 166 | AA100: 30 | AB100: -0.040000000000000001
A101: ="601668" -> 601668 | B101: 中国建筑 | C101: -0.79000000000000004 | D101: 460290 | E101: 2579.55亿 | F101: 0.11 | G101: 6.2699999999999996 | H101: 6.2699999999999996 | I101: 6.2800000000000002 | J101: 4601 | K101: 0.16 | L101: 6.2999999999999998 | M101: 6.2999999999999998 | N101: 6.2300000000000004 | O101: 6.3200000000000003 | P101: 7.2300000000000004 | Q101: 288251936 | R101: 5.0300000000000002 | S101: 建筑工程 | T101: 北京 | U101: 1.1100000000000001 | V101: 6.2599999999999998 | W101: 206244 | X101: 254046 | Y101: 0.81000000000000005 | Z101: 5034 | AA101: 1388 | AB101: -0.050000000000000003
A102: ="600740" -> 600740 | B102: 山西焦化 | C102: -0.63 | D102: 53578 | E102: 62.27亿 | F102: 0.81999999999999995 | G102: 9.4800000000000004 | H102: 9.4800000000000004 | I102: 9.5 | J102: 205 | K102: 1.1699999999999999 | L102: 9.4499999999999993 | M102: 9.4900000000000002 | N102: 9.3499999999999996 | O102: 9.5399999999999991 | P102: 8.3699999999999992 | Q102: 50408592 | R102: 3.5299999999999998 | S102: 焦炭加工 | T102: 山西 | U102: 1.47 | V102: 9.4100000000000001 | W102: 31808 | X102: 21770 | Y102: 1.46 | Z102: 98 | AA102: 487 | AB102: -0.059999999999999998
A103: ="000721" -> 000721 | B103: 西安饮食 | C103: -1.1299999999999999 | D103: 17499 | E103: 19.09亿 | F103: 0.40000000000000002 | G103: 4.3799999999999999 | H103: 4.3700000000000001 | I103: 4.3799999999999999 | J103: 43 | K103: 0.68999999999999995 | L103: 4.4199999999999999 | M103: 4.4199999999999999 | N103: 4.3399999999999999 | O103: 4.4299999999999997 | P103: -- | Q103: 7650150 | R103: 4.0800000000000001 | S103: 酒店餐饮 | T103: 陕西 | U103: 1.8100000000000001 | V103: 4.3700000000000001 | W103: 9073 | X103: 8426 | Y103: 1.0800000000000001 | Z103: 106 | AA103: 125 | AB103: -0.050000000000000003
A104: ="000099" -> 000099 | B104: 中信海直 | C104: 0.40999999999999998 | D104: 11067 | E104: 44.12亿 | F104: 0.17999999999999999 | G104: 7.2800000000000002 | H104: 7.2800000000000002 | I104: 7.29 | J104: 20 | K104: 1.3899999999999999 | L104: 7.21 | M104: 7.2800000000000002 | N104: 7.1299999999999999 | O104: 7.25 | P104: 37.600000000000001 | Q104: 7954630 | R104: 2.4399999999999999 | S104: 空运 | T104: 深圳 | U104: 2.0699999999999998 | V104: 7.1900000000000004 | W104: 5763 | X104: 5304 | Y104: 1.0900000000000001 | Z104: 80 | AA104: 56 | AB104: 0.029999999999999999
A105: ="300073" -> 300073 | B105: 当升科技 | C105: 0.89000000000000001 | D105: 19835 | E105: 112.87亿 | F105: 0.56000000000000005 | G105: 31.899999999999999 | H105: 31.890000000000001 | I105: 31.899999999999999 | J105: 45 | K105: 1.8799999999999999 | L105: 31.199999999999999 | M105: 31.940000000000001 | N105: 31.199999999999999 | O105: 31.620000000000001 | P105: 50.890000000000001 | Q105: 62384612 | R105: 3.5899999999999999 | S105: 矿物制品 | T105: 北京 | U105: 2.3399999999999999 | V105: 31.449999999999999 | W105: 11522 | X105: 8313 | Y105: 1.3899999999999999 | Z105: 37 | AA105: 1 | AB105: 0.28000000000000003
A106: ="002679" -> 002679 | B106: 福建金森 | C106: -1.1699999999999999 | D106: 3966 | E106: 49.86亿 | F106: 0.17000000000000001 | G106: 21.149999999999999 | H106: 21.120000000000001 | I106: 21.149999999999999 | J106: 14 | K106: -0.23000000000000001 | L106: 21.399999999999999 | M106: 21.600000000000001 | N106: 21.100000000000001 | O106: 21.399999999999999 | P106: 291.19999999999999 | Q106: 8445738 | R106: 2.3599999999999999 | S106: 林业 | T106: 福建 | U106: 2.3399999999999999 | V106: 21.300000000000001 | W106: 2869 | X106: 1097 | Y106: 2.6200000000000001 | Z106: 130 | AA106: 15 | AB106: -0.25
A107: ="601888" -> 601888 | B107: 中国国旅 | C107: 0.70999999999999996 | D107: 15178 | E107: 1273.60亿 | F107: 0.080000000000000002 | G107: 65.230000000000004 | H107: 65.230000000000004 | I107: 65.239999999999995 | J107: 41 | K107: -1.0800000000000001 | L107: 64.760000000000005 | M107: 66.040000000000006 | N107: 64 | O107: 64.769999999999996 | P107: 35.310000000000002 | Q107: 99161576 | R107: 4.2300000000000004 | S107: 旅游服务 | T107: 北京 | U107: 3.1499999999999999 | V107: 65.329999999999998 | W107: 7506 | X107: 7672 | Y107: 0.97999999999999998 | Z107: 17 | AA107: 18 | AB107: 0.46000000000000002
A108: ="600593" -> 600593 | B108: 大连圣亚 | C108: -0.71999999999999997 | D108: 1182 | E108: 37.44亿 | F108: 0.089999999999999997 | G108: 29.07 | H108: 29.030000000000001 | I108: 29.07 | J108: 51 | K108: -0.5 | L108: 29.289999999999999 | M108: 29.350000000000001 | N108: 29.030000000000001 | O108: 29.280000000000001 | P108: 30.75 | Q108: 3452391 | R108: 3.2000000000000002 | S108: 旅游服务 | T108: 辽宁 | U108: 1.0900000000000001 | V108: 29.210000000000001 | W108: 783 | X108: 399 | Y108: 1.96 | Z108: 95 | AA108: 8 | AB108: -0.20999999999999999
A109: ="000548" -> 000548 | B109: 湖南投资 | C109: 3.29 | D109: 17333 | E109: 25.11亿 | F109: 0.34999999999999998 | G109: 5.0300000000000002 | H109: 5.0199999999999996 | I109: 5.0300000000000002 | J109: 28 | K109: 2.8599999999999999 | L109: 4.8700000000000001 | M109: 5.0300000000000002 | N109: 4.8600000000000003 | O109: 4.8700000000000001 | P109: 71.950000000000003 | Q109: 8537394 | R109: 6.0199999999999996 | S109: 路桥 | T109: 湖南 | U109: 3.4900000000000002 | V109: 4.9299999999999997 | W109: 7745 | X109: 9587 | Y109: 0.81000000000000005 | Z109: 464 | AA109: 83 | AB109: 0.16
A110: ="600548" -> 600548 | B110: 深高速 | C110: -0.63 | D110: 9545 | E110: 134.87亿 | F110: 0.070000000000000007 | G110: 9.4100000000000001 | H110: 9.4000000000000004 | I110: 9.4100000000000001 | J110: 8 | K110: -0.10000000000000001 | L110: 9.5 | M110: 9.5 | N110: 9.3900000000000006 | O110: 9.4700000000000006 | P110: 10.119999999999999 | Q110: 9010824 | R110: 2.5600000000000001 | S110: 路桥 | T110: 深圳 | U110: 1.1599999999999999 | V110: 9.4399999999999995 | W110: 5236 | X110: 4309 | Y110: 1.22 | Z110: 196 | AA110: 245 | AB110: -0.059999999999999998
A111: ="000429" -> 000429 | B111: 粤高速Ａ | C111: -0.89000000000000001 | D111: 14176 | E111: 41.92亿 | F111: 0.29999999999999999 | G111: 8.9399999999999995 | H111: 8.9299999999999997 | I111: 8.9399999999999995 | J111: 1 | K111: 0.45000000000000001 | L111: 9.0199999999999996 | M111: 9.0299999999999994 | N111: 8.8499999999999996 | O111: 9.0199999999999996 | P111: 11.49 | Q111: 12648447 | R111: 2.2999999999999998 | S111: 路桥 | T111: 广东 | U111: 2 | V111: 8.9199999999999999 | W111: 6760 | X111: 7416 | Y111: 0.91000000000000003 | Z111: 125 | AA111: 5 | AB111: -0.080000000000000002
A112: ="601088" -> 601088 | B112: 中国神华 | C112: 0.39000000000000001 | D112: 46608 | E112: 3410.35亿 | F112: 0.029999999999999999 | G112: 20.68 | H112: 20.670000000000002 | I112: 20.68 | J112: 181 | K112: 0.63 | L112: 20.5 | M112: 20.75 | N112: 20.390000000000001 | O112: 20.600000000000001 | P112: 8.7400000000000002 | Q112: 95786912 | R112: 4.7000000000000002 | S112: 煤炭开采 | T112: 北京 | U112: 1.75 | V112: 20.550000000000001 | W112: 22450 | X112: 24157 | Y112: 0.93000000000000005 | Z112: 37 | AA112: 85 | AB112: 0.080000000000000002
A113: ="601225" -> 601225 | B113: 陕西煤业 | C113: 0.11 | D113: 68581 | E113: 886.00亿 | F113: 0.070000000000000007 | G113: 8.8599999999999994 | H113: 8.8599999999999994 | I113: 8.8699999999999992 | J113: 366 | K113: 1.03 | L113: 8.8100000000000005 | M113: 8.8599999999999994 | N113: 8.6799999999999997 | O113: 8.8499999999999996 | P113: 7.5 | Q113: 60094488 | R113: 2.8799999999999999 | S113: 煤炭开采 | T113: 陕西 | U113: 2.0299999999999998 | V113: 8.7599999999999998 | W113: 31201 | X113: 37379 | Y113: 0.82999999999999996 | Z113: 219 | AA113: 565 | AB113: 0.01
A114: ="600997" -> 600997 | B114: 开滦股份 | C114: -0.14999999999999999 | D114: 34061 | E114: 82.60亿 | F114: 0.28000000000000003 | G114: 6.6900000000000004 | H114: 6.6900000000000004 | I114: 6.7000000000000002 | J114: 109 | K114: 0.75 | L114: 6.6900000000000004 | M114: 6.6900000000000004 | N114: 6.5999999999999996 | O114: 6.7000000000000002 | P114: 8.0399999999999991 | Q114: 22637416 | R114: 3.9500000000000002 | S114: 煤炭开采 | T114: 河北 | U114: 1.3400000000000001 | V114: 6.6500000000000004 | W114: 15618 | X114: 18443 | Y114: 0.84999999999999998 | Z114: 189 | AA114: 376 | AB114: -0.01
A115: ="600731" -> 600731 | B115: 湖南海利 | C115: -0.58999999999999997 | D115: 6205 | E115: 16.50亿 | F115: 0.19 | G115: 5.0499999999999998 | H115: 5.0499999999999998 | I115: 5.0599999999999996 | J115: 1 | K115: 0 | L115: 5.0800000000000001 | M115: 5.0899999999999999 | N115: 5.0300000000000002 | O115: 5.0800000000000001 | P115: 118.84 | Q115: 3137717 | R115: 4.0800000000000001 | S115: 农药化肥 | T115: 湖南 | U115: 1.1799999999999999 | V115: 5.0599999999999996 | W115: 4663 | X115: 1542 | Y115: 3.02 | Z115: 20 | AA115: 4 | AB115: -0.029999999999999999
A116: ="000902" -> 000902 | B116: 新洋丰 | C116: -0.60999999999999999 | D116: 19376 | E116: 114.01亿 | F116: 0.17000000000000001 | G116: 9.7200000000000006 | H116: 9.6799999999999997 | I116: 9.7200000000000006 | J116: 128 | K116: 0 | L116: 9.8100000000000005 | M116: 9.8300000000000001 | N116: 9.6600000000000001 | O116: 9.7799999999999994 | P116: 12.92 | Q116: 18870258 | R116: 4.9699999999999998 | S116: 农药化肥 | T116: 湖北 | U116: 1.74 | V116: 9.7400000000000002 | W116: 11174 | X116: 8202 | Y116: 1.3600000000000001 | Z116: 557 | AA116: 225 | AB116: -0.059999999999999998
A117: ="600486" -> 600486 | B117: 扬农化工 | C117: -1.44 | D117: 2024 | E117: 148.75亿 | F117: 0.070000000000000007 | G117: 48 | H117: 47.960000000000001 | I117: 48 | J117: 2 | K117: 0.44 | L117: 48.600000000000001 | M117: 48.600000000000001 | N117: 47.710000000000001 | O117: 48.700000000000003 | P117: 14.19 | Q117: 9686385 | R117: 1.51 | S117: 农药化肥 | T117: 江苏 | U117: 1.8300000000000001 | V117: 47.859999999999999 | W117: 1269 | X117: 755 | Y117: 1.6799999999999999 | Z117: 13 | AA117: 60 | AB117: -0.69999999999999996
A118: ="002234" -> 002234 | B118: 民和股份 | C118: 3.73 | D118: 25695 | E118: 48.42亿 | F118: 1.3400000000000001 | G118: 25.329999999999998 | H118: 25.329999999999998 | I118: 25.5 | J118: 68 | K118: 2.6299999999999999 | L118: 24.120000000000001 | M118: 25.670000000000002 | N118: 24.120000000000001 | O118: 24.420000000000002 | P118: 41.270000000000003 | Q118: 63671764 | R118: 3.1699999999999999 | S118: 农业综合 | T118: 山东 | U118: 6.3499999999999996 | V118: 24.780000000000001 | W118: 10972 | X118: 14722 | Y118: 0.75 | Z118: 2 | AA118: 19 | AB118: 0.91000000000000003
A119: ="002299" -> 002299 | B119: 圣农发展 | C119: 1.96 | D119: 24902 | E119: 289.28亿 | F119: 0.22 | G119: 26.039999999999999 | H119: 26.039999999999999 | I119: 26.16 | J119: 77 | K119: 1.6000000000000001 | L119: 25.559999999999999 | M119: 26.399999999999999 | N119: 25.07 | O119: 25.539999999999999 | P119: 30.09 | Q119: 64070116 | R119: 2.3100000000000001 | S119: 农业综合 | T119: 福建 | U119: 5.21 | V119: 25.73 | W119: 13458 | X119: 11444 | Y119: 1.1799999999999999 | Z119: 55 | AA119: 12 | AB119: 0.5
A120: ="002714" -> 002714 | B120: 牧原股份 | C120: -0.56999999999999995 | D120: 28750 | E120: 543.94亿 | F120: 0.23999999999999999 | G120: 45.649999999999999 | H120: 45.649999999999999 | I120: 45.689999999999998 | J120: 46 | K120: 0.81999999999999995 | L120: 45.329999999999998 | M120: 45.75 | N120: 44.899999999999999 | O120: 45.909999999999997 | P120: 203.87000000000001 | Q120: 129994648 | R120: 4.0300000000000002 | S120: 农业综合 | T120: 河南 | U120: 1.8500000000000001 | V120: 45.219999999999999 | W120: 15242 | X120: 13507 | Y120: 1.1299999999999999 | Z120: 32 | AA120: 114 | AB120: -0.26000000000000001
A121: ="000816" -> 000816 | B121: *ST慧业 | C121: -0.53000000000000003 | D121: 37778 | E121: 25.26亿 | F121: 0.28000000000000003 | G121: 1.8899999999999999 | H121: 1.8799999999999999 | I121: 1.8899999999999999 | J121: 3 | K121: 0.53000000000000003 | L121: 1.8999999999999999 | M121: 1.9099999999999999 | N121: 1.8700000000000001 | O121: 1.8999999999999999 | P121: -- | Q121: 7134629 | R121: 3.02 | S121: 农用机械 | T121: 江苏 | U121: 2.1099999999999999 | V121: 1.8899999999999999 | W121: 24380 | X121: 13398 | Y121: 1.8200000000000001 | Z121: 5938 | AA121: 7114 | AB121: -0.01
A122: ="300022" -> 300022 | B122: 吉峰科技 | C122: -0.92000000000000004 | D122: 14452 | E122: 14.74亿 | F122: 0.41999999999999998 | G122: 4.2999999999999998 | H122: 4.29 | I122: 4.2999999999999998 | J122: 79 | K122: 0 | L122: 4.3399999999999999 | M122: 4.3399999999999999 | N122: 4.2699999999999996 | O122: 4.3399999999999999 | P122: 533.95000000000005 | Q122: 6203309 | R122: 2.0499999999999998 | S122: 农用机械 | T122: 四川 | U122: 1.6100000000000001 | V122: 4.29 | W122: 8984 | X122: 5468 | Y122: 1.6399999999999999 | Z122: 587 | AA122: 311 | AB122: -0.040000000000000001
A123: ="600132" -> 600132 | B123: 重庆啤酒 | C123: -1.8300000000000001 | D123: 3387 | E123: 163.44亿 | F123: 0.070000000000000007 | G123: 33.770000000000003 | H123: 33.759999999999998 | I123: 33.780000000000001 | J123: 1 | K123: 0.33000000000000002 | L123: 34.329999999999998 | M123: 34.350000000000001 | N123: 33.490000000000002 | O123: 34.399999999999999 | P123: 31.870000000000001 | Q123: 11439820 | R123: 3.4199999999999999 | S123: 啤酒 | T123: 重庆 | U123: 2.5 | V123: 33.770000000000003 | W123: 1711 | X123: 1676 | Y123: 1.02 | Z123: 70 | AA123: 68 | AB123: -0.63
A124: ="600782" -> 600782 | B124: 新钢股份 | C124: 0.34000000000000002 | D124: 120042 | E124: 188.13亿 | F124: 0.38 | G124: 5.9000000000000004 | H124: 5.8899999999999997 | I124: 5.9000000000000004 | J124: 312 | K124: 0.68000000000000005 | L124: 5.9000000000000004 | M124: 5.9000000000000004 | N124: 5.8300000000000001 | O124: 5.8799999999999999 | P124: 3.5699999999999998 | Q124: 70468448 | R124: 4.2699999999999996 | S124: 普钢 | T124: 江西 | U124: 1.19 | V124: 5.8700000000000001 | W124: 49745 | X124: 70296 | Y124: 0.70999999999999996 | Z124: 2544 | AA124: 4567 | AB124: 0.02
A125: ="600808" -> 600808 | B125: 马钢股份 | C125: -0.26000000000000001 | D125: 85572 | E125: 232.15亿 | F125: 0.14000000000000001 | G125: 3.8900000000000001 | H125: 3.8900000000000001 | I125: 3.8999999999999999 | J125: 82 | K125: 0.78000000000000003 | L125: 3.8999999999999999 | M125: 3.9100000000000001 | N125: 3.8399999999999999 | O125: 3.8999999999999999 | P125: 4.0199999999999996 | Q125: 33172716 | R125: 4.3300000000000001 | S125: 普钢 | T125: 安徽 | U125: 1.79 | V125: 3.8799999999999999 | W125: 45841 | X125: 39731 | Y125: 1.1499999999999999 | Z125: 428 | AA125: 3826 | AB125: -0.01
A126: ="000709" -> 000709 | B126: 河钢股份 | C126: -0.29999999999999999 | D126: 107137 | E126: 347.17亿 | F126: 0.10000000000000001 | G126: 3.27 | H126: 3.27 | I126: 3.2799999999999998 | J126: 40 | K126: 0.62 | L126: 3.27 | M126: 3.2799999999999998 | N126: 3.2400000000000002 | O126: 3.2799999999999998 | P126: 7.7300000000000004 | Q126: 34932144 | R126: 4.6100000000000003 | S126: 普钢 | T126: 河北 | U126: 1.22 | V126: 3.2599999999999998 | W126: 41529 | X126: 65607 | Y126: 0.63 | Z126: 1788 | AA126: 18550 | AB126: -0.01
A127: ="601003" -> 601003 | B127: 柳钢股份 | C127: -1.1599999999999999 | D127: 36751 | E127: 196.57亿 | F127: 0.14000000000000001 | G127: 7.6699999999999999 | H127: 7.6699999999999999 | I127: 7.6799999999999997 | J127: 139 | K127: 0.79000000000000004 | L127: 7.7300000000000004 | M127: 7.7300000000000004 | N127: 7.5800000000000001 | O127: 7.7599999999999998 | P127: 4.5300000000000002 | Q127: 28053516 | R127: 3.5099999999999998 | S127: 普钢 | T127: 广西 | U127: 1.9299999999999999 | V127: 7.6299999999999999 | W127: 20896 | X127: 15855 | Y127: 1.3200000000000001 | Z127: 107 | AA127: 18 | AB127: -0.089999999999999997
A128: ="000655" -> 000655 | B128: *ST金岭 | C128: -1.1799999999999999 | D128: 7747 | E128: 24.83亿 | F128: 0.13 | G128: 4.1699999999999999 | H128: 4.1699999999999999 | I128: 4.1799999999999997 | J128: 635 | K128: 0 | L128: 4.1900000000000004 | M128: 4.1900000000000004 | N128: 4.1600000000000001 | O128: 4.2199999999999998 | P128: 25.219999999999999 | Q128: 3233912 | R128: 2.6400000000000001 | S128: 普钢 | T128: 山东 | U128: 0.70999999999999996 | V128: 4.1699999999999999 | W128: 4612 | X128: 3135 | Y128: 1.47 | Z128: 746 | AA128: 28 | AB128: -0.050000000000000003
A129: ="002372" -> 002372 | B129: 伟星新材 | C129: -0.12 | D129: 7611 | E129: 195.18亿 | F129: 0.059999999999999998 | G129: 16.66 | H129: 16.649999999999999 | I129: 16.66 | J129: 46 | K129: 0.41999999999999998 | L129: 16.68 | M129: 16.719999999999999 | N129: 16.52 | O129: 16.68 | P129: 25.039999999999999 | Q129: 12652624 | R129: 1.6599999999999999 | S129: 其他建材 | T129: 浙江 | U129: 1.2 | V129: 16.620000000000001 | W129: 3498 | X129: 4113 | Y129: 0.84999999999999998 | Z129: 6 | AA129: 190 | AB129: -0.02
A130: ="600321" -> 600321 | B130: *ST正源 | C130: -0.44 | D130: 6802 | E130: 34.14亿 | F130: 0.050000000000000003 | G130: 2.2599999999999998 | H130: 2.25 | I130: 2.2599999999999998 | J130: 50 | K130: 0 | L130: 2.27 | M130: 2.29 | N130: 2.25 | O130: 2.27 | P130: 140.00999999999999 | Q130: 1538653 | R130: 1.46 | S130: 其他建材 | T130: 四川 | U130: 1.76 | V130: 2.2599999999999998 | W130: 4291 | X130: 2511 | Y130: 1.71 | Z130: 3148 | AA130: 81 | AB130: -0.01
A131: ="600660" -> 600660 | B131: 福耀玻璃 | C131: -0.080000000000000002 | D131: 20936 | E131: 500.15亿 | F131: 0.10000000000000001 | G131: 24.969999999999999 | H131: 24.949999999999999 | I131: 24.969999999999999 | J131: 46 | K131: 0.32000000000000001 | L131: 25.059999999999999 | M131: 25.059999999999999 | N131: 24.800000000000001 | O131: 24.989999999999998 | P131: 14.4 | Q131: 52255796 | R131: 4.3200000000000003 | S131: 汽车配件 | T131: 福建 | U131: 1.04 | V131: 24.960000000000001 | W131: 9163 | X131: 11773 | Y131: 0.78000000000000003 | Z131: 253 | AA131: 20 | AB131: -0.02
A132: ="002703" -> 002703 | B132: 浙江世宝 | C132: -0.40999999999999998 | D132: 11634 | E132: 26.82亿 | F132: 0.20999999999999999 | G132: 4.8499999999999996 | H132: 4.8399999999999999 | I132: 4.8499999999999996 | J132: 10 | K132: 0.62 | L132: 4.8600000000000003 | M132: 4.8600000000000003 | N132: 4.7999999999999998 | O132: 4.8700000000000001 | P132: -- | Q132: 5613174 | R132: 2.6699999999999999 | S132: 汽车配件 | T132: 浙江 | U132: 1.23 | V132: 4.8300000000000001 | W132: 6557 | X132: 5076 | Y132: 1.29 | Z132: 1283 | AA132: 207 | AB132: -0.02
A133: ="600178" -> 600178 | B133: 东安动力 | C133: -0.56999999999999995 | D133: 11693 | E133: 24.31亿 | F133: 0.25 | G133: 5.2599999999999998 | H133: 5.2599999999999998 | I133: 5.2699999999999996 | J133: 117 | K133: 0.95999999999999996 | L133: 5.25 | M133: 5.29 | N133: 5.1799999999999997 | O133: 5.29 | P133: 27.579999999999998 | Q133: 6126041 | R133: 2.4700000000000002 | S133: 汽车配件 | T133: 黑龙江 | U133: 2.0800000000000001 | V133: 5.2400000000000002 | W133: 7102 | X133: 4591 | Y133: 1.55 | Z133: 121 | AA133: 26 | AB133: -0.029999999999999999
A134: ="000338" -> 000338 | B134: 潍柴动力 | C134: -0.70999999999999996 | D134: 91735 | E134: 418.02亿 | F134: 0.22 | G134: 9.8499999999999996 | H134: 9.8399999999999999 | I134: 9.8499999999999996 | J134: 629 | K134: 0.92000000000000004 | L134: 9.9000000000000004 | M134: 9.9100000000000001 | N134: 9.7100000000000009 | O134: 9.9199999999999999 | P134: 9.7699999999999996 | Q134: 89761504 | R134: 3.0099999999999998 | S134: 汽车配件 | T134: 山东 | U134: 2.02 | V134: 9.7799999999999994 | W134: 55577 | X134: 36158 | Y134: 1.54 | Z134: 204 | AA134: 327 | AB134: -0.070000000000000007
A135: ="601799" -> 601799 | B135: 星宇股份 | C135: -1.01 | D135: 418 | E135: 154.65亿 | F135: 0.02 | G135: 56 | H135: 56 | I135: 56.149999999999999 | J135: 1 | K135: 0.45000000000000001 | L135: 56.399999999999999 | M135: 56.600000000000001 | N135: 55.579999999999998 | O135: 56.57 | P135: 26.399999999999999 | Q135: 2349385 | R135: 1.1299999999999999 | S135: 汽车配件 | T135: 江苏 | U135: 1.8 | V135: 56.210000000000001 | W135: 280 | X135: 138 | Y135: 2.0299999999999998 | Z135: 2 | AA135: 5 | AB135: -0.56999999999999995
A136: ="300176" -> 300176 | B136: 派生科技 | C136: -1.23 | D136: 1217 | E136: 147.07亿 | F136: 0.029999999999999999 | G136: 39.390000000000001 | H136: 39.380000000000003 | I136: 39.390000000000001 | J136: 1 | K136: 0.47999999999999998 | L136: 39.710000000000001 | M136: 39.710000000000001 | N136: 39.100000000000001 | O136: 39.880000000000003 | P136: 29.550000000000001 | Q136: 4797062 | R136: 3.8599999999999999 | S136: 汽车配件 | T136: 广东 | U136: 1.53 | V136: 39.420000000000002 | W136: 605 | X136: 611 | Y136: 0.98999999999999999 | Z136: 2 | AA136: 30 | AB136: -0.48999999999999999
A137: ="600469" -> 600469 | B137: 风神股份 | C137: -1.3200000000000001 | D137: 5242 | E137: 25.14亿 | F137: 0.089999999999999997 | G137: 4.4699999999999998 | H137: 4.4699999999999998 | I137: 4.4800000000000004 | J137: 1 | K137: 0.22 | L137: 4.5700000000000003 | M137: 4.5700000000000003 | N137: 4.4299999999999997 | O137: 4.5300000000000002 | P137: 1008.34 | Q137: 2346102 | R137: 1.8 | S137: 汽车配件 | T137: 河南 | U137: 3.0899999999999999 | V137: 4.4800000000000004 | W137: 4151 | X137: 1091 | Y137: 3.7999999999999998 | Z137: 212 | AA137: 80 | AB137: -0.059999999999999998
A138: ="002590" -> 002590 | B138: 万安科技 | C138: -2.0499999999999998 | D138: 14785 | E138: 33.19亿 | F138: 0.34000000000000002 | G138: 7.6399999999999997 | H138: 7.6399999999999997 | I138: 7.6500000000000004 | J138: 14 | K138: 1.19 | L138: 7.75 | M138: 7.75 | N138: 7.5300000000000002 | O138: 7.7999999999999998 | P138: 35.5 | Q138: 11280531 | R138: 3.2599999999999998 | S138: 汽车配件 | T138: 浙江 | U138: 2.8199999999999998 | V138: 7.6299999999999999 | W138: 9130 | X138: 5655 | Y138: 1.6100000000000001 | Z138: 4 | AA138: 87 | AB138: -0.16
A139: ="002537" -> 002537 | B139: 海联金汇 | C139: -2.1600000000000001 | D139: 10431 | E139: 129.65亿 | F139: 0.089999999999999997 | G139: 10.85 | H139: 10.84 | I139: 10.85 | J139: 52 | K139: 0.089999999999999997 | L139: 10.949999999999999 | M139: 10.98 | N139: 10.779999999999999 | O139: 11.09 | P139: 35.200000000000003 | Q139: 11328309 | R139: 3.0899999999999999 | S139: 汽车整车 | T139: 山东 | U139: 1.8 | V139: 10.859999999999999 | W139: 6543 | X139: 3887 | Y139: 1.6799999999999999 | Z139: 44 | AA139: 36 | AB139: -0.23999999999999999
A140: ="000688" -> 000688 | B140: 国城矿业 | C140: -0.81000000000000005 | D140: 2585 | E140: 139.77亿 | F140: 0.02 | G140: 12.289999999999999 | H140: 12.26 | I140: 12.289999999999999 | J140: 13 | K140: 0.73999999999999999 | L140: 12.390000000000001 | M140: 12.4 | N140: 12.19 | O140: 12.390000000000001 | P140: 34.119999999999997 | Q140: 3168281 | R140: 2.6800000000000002 | S140: 铅锌 | T140: 重庆 | U140: 1.69 | V140: 12.26 | W140: 1395 | X140: 1190 | Y140: 1.1699999999999999 | Z140: 27 | AA140: 9 | AB140: -0.10000000000000001
A141: ="002209" -> 002209 | B141: 达 意 隆 | C141: -1.5700000000000001 | D141: 10881 | E141: 11.59亿 | F141: 0.70999999999999996 | G141: 7.54 | H141: 7.54 | I141: 7.5499999999999998 | J141: 17 | K141: 0.80000000000000004 | L141: 7.5999999999999996 | M141: 7.5999999999999996 | N141: 7.4199999999999999 | O141: 7.6600000000000001 | P141: -- | Q141: 8176209 | R141: 3.0499999999999998 | S141: 轻工机械 | T141: 广东 | U141: 2.3500000000000001 | V141: 7.5099999999999998 | W141: 5458 | X141: 5423 | Y141: 1.01 | Z141: 272 | AA141: 293 | AB141: -0.12
A142: ="600743" -> 600743 | B142: 华远地产 | C142: 5.3799999999999999 | D142: 44149 | E142: 68.98亿 | F142: 0.19 | G142: 2.9399999999999999 | H142: 2.9300000000000002 | I142: 2.9399999999999999 | J142: 163 | K142: 3.8900000000000001 | L142: 2.7999999999999998 | M142: 2.9399999999999999 | N142: 2.79 | O142: 2.79 | P142: 17.73 | Q142: 12548928 | R142: 8.9199999999999999 | S142: 区域地产 | T142: 北京 | U142: 5.3799999999999999 | V142: 2.8399999999999999 | W142: 13596 | X142: 30553 | Y142: 0.44 | Z142: 10 | AA142: 211 | AB142: 0.14999999999999999
A143: ="600340" -> 600340 | B143: 华夏幸福 | C143: 1.6399999999999999 | D143: 26252 | E143: 952.08亿 | F143: 0.089999999999999997 | G143: 32.219999999999999 | H143: 32.210000000000001 | I143: 32.219999999999999 | J143: 476 | K143: 1.0700000000000001 | L143: 31.600000000000001 | M143: 32.299999999999997 | N143: 31.579999999999998 | O143: 31.699999999999999 | P143: 9.2100000000000009 | Q143: 83774872 | R143: 3.5800000000000001 | S143: 区域地产 | T143: 河北 | U143: 2.27 | V143: 31.91 | W143: 11698 | X143: 14554 | Y143: 0.80000000000000004 | Z143: 9 | AA143: 11 | AB143: 0.52000000000000002
A144: ="000656" -> 000656 | B144: 金科股份 | C144: 0.81000000000000005 | D144: 34792 | E144: 325.86亿 | F144: 0.070000000000000007 | G144: 6.1900000000000004 | H144: 6.1900000000000004 | I144: 6.2000000000000002 | J144: 167 | K144: 0.97999999999999998 | L144: 6.1500000000000004 | M144: 6.2199999999999998 | N144: 6.0999999999999996 | O144: 6.1399999999999997 | P144: 11.310000000000001 | Q144: 21403316 | R144: 6.0800000000000001 | S144: 区域地产 | T144: 重庆 | U144: 1.95 | V144: 6.1500000000000004 | W144: 17201 | X144: 17591 | Y144: 0.97999999999999998 | Z144: 92 | AA144: 487 | AB144: 0.050000000000000003
A145: ="600159" -> 600159 | B145: 大龙地产 | C145: 0 | D145: 8447 | E145: 23.82亿 | F145: 0.10000000000000001 | G145: 2.8700000000000001 | H145: 2.8700000000000001 | I145: 2.8799999999999999 | J145: 2 | K145: 0.69999999999999996 | L145: 2.8700000000000001 | M145: 2.8799999999999999 | N145: 2.8399999999999999 | O145: 2.8700000000000001 | P145: -- | Q145: 2415495 | R145: 2.9100000000000001 | S145: 区域地产 | T145: 北京 | U145: 1.3899999999999999 | V145: 2.8599999999999999 | W145: 4686 | X145: 3761 | Y145: 1.25 | Z145: 268 | AA145: 445 | AB145: 0
A146: ="600675" -> 600675 | B146: 中华企业 | C146: -0.34000000000000002 | D146: 10260 | E146: 109.60亿 | F146: 0.050000000000000003 | G146: 5.8700000000000001 | H146: 5.8600000000000003 | I146: 5.8700000000000001 | J146: 160 | K146: 0.51000000000000001 | L146: 5.9500000000000002 | M146: 5.9699999999999998 | N146: 5.8399999999999999 | O146: 5.8899999999999997 | P146: 27.48 | Q146: 6049372 | R146: 5.2999999999999998 | S146: 区域地产 | T146: 上海 | U146: 2.21 | V146: 5.9000000000000004 | W146: 5398 | X146: 4861 | Y146: 1.1100000000000001 | Z146: 148 | AA146: 29 | AB146: -0.02
A147: ="000573" -> 000573 | B147: 粤宏远Ａ | C147: -1.1499999999999999 | D147: 14311 | E147: 21.46亿 | F147: 0.23000000000000001 | G147: 3.4500000000000002 | H147: 3.4500000000000002 | I147: 3.46 | J147: 75 | K147: -0.56999999999999995 | L147: 3.4900000000000002 | M147: 3.5 | N147: 3.4199999999999999 | O147: 3.4900000000000002 | P147: -- | Q147: 4955014 | R147: 4.3799999999999999 | S147: 区域地产 | T147: 广东 | U147: 2.29 | V147: 3.46 | W147: 7476 | X147: 6835 | Y147: 1.0900000000000001 | Z147: 566 | AA147: 794 | AB147: -0.040000000000000001
A148: ="002146" -> 002146 | B148: 荣盛发展 | C148: 1.78 | D148: 62637 | E148: 378.84亿 | F148: 0.16 | G148: 9.7300000000000004 | H148: 9.7300000000000004 | I148: 9.7400000000000002 | J148: 125 | K148: 1.46 | L148: 9.5999999999999996 | M148: 9.8000000000000007 | N148: 9.5 | O148: 9.5600000000000005 | P148: 8.4900000000000002 | Q148: 60503524 | R148: 3.8599999999999999 | S148: 全国地产 | T148: 河北 | U148: 3.1400000000000001 | V148: 9.6600000000000001 | W148: 27970 | X148: 34666 | Y148: 0.81000000000000005 | Z148: 228 | AA148: 104 | AB148: 0.17000000000000001
A149: ="000002" -> 000002 | B149: 万 科Ａ | C149: 1.48 | D149: 138129 | E149: 2798.94亿 | F149: 0.14000000000000001 | G149: 28.809999999999999 | H149: 28.800000000000001 | I149: 28.809999999999999 | J149: 402 | K149: 1.3700000000000001 | L149: 28.460000000000001 | M149: 28.850000000000001 | N149: 28.309999999999999 | O149: 28.390000000000001 | P149: 17.059999999999999 | Q149: 393938176 | R149: 4.7800000000000002 | S149: 全国地产 | T149: 深圳 | U149: 1.8999999999999999 | V149: 28.52 | W149: 54064 | X149: 84064 | Y149: 0.64000000000000001 | Z149: 453 | AA149: 63 | AB149: 0.41999999999999998
A150: ="600383" -> 600383 | B150: 金地集团 | C150: 0.96999999999999997 | D150: 31251 | E150: 518.73亿 | F150: 0.070000000000000007 | G150: 11.49 | H150: 11.49 | I150: 11.5 | J150: 226 | K150: 1.77 | L150: 11.35 | M150: 11.52 | N150: 11.24 | O150: 11.380000000000001 | P150: 7.4199999999999999 | Q150: 35506680 | R150: 2.9700000000000002 | S150: 全国地产 | T150: 深圳 | U150: 2.46 | V150: 11.359999999999999 | W150: 13443 | X150: 17807 | Y150: 0.75 | Z150: 28 | AA150: 193 | AB150: 0.11
A151: ="600048" -> 600048 | B151: 保利地产 | C151: -0.28999999999999998 | D151: 184926 | E151: 1598.76亿 | F151: 0.16 | G151: 13.58 | H151: 13.57 | I151: 13.58 | J151: 624 | K151: 0.96999999999999997 | L151: 13.5 | M151: 13.65 | N151: 13.41 | O151: 13.619999999999999 | P151: 12.630000000000001 | Q151: 249467712 | R151: 3.77 | S151: 全国地产 | T151: 广东 | U151: 1.76 | V151: 13.49 | W151: 85646 | X151: 99279 | Y151: 0.85999999999999999 | Z151: 53 | AA151: 505 | AB151: -0.040000000000000001
A152: ="600887" -> 600887 | B152: 伊利股份 | C152: 0 | D152: 109577 | E152: 1601.15亿 | F152: 0.17999999999999999 | G152: 26.510000000000002 | H152: 26.5 | I152: 26.510000000000002 | J152: 165 | K152: 0.38 | L152: 26.41 | M152: 26.600000000000001 | N152: 26.239999999999998 | O152: 26.510000000000002 | P152: 23.940000000000001 | Q152: 289102336 | R152: 5.3399999999999999 | S152: 乳制品 | T152: 内蒙 | U152: 1.3600000000000001 | V152: 26.379999999999999 | W152: 50624 | X152: 58953 | Y152: 0.85999999999999999 | Z152: 678 | AA152: 367 | AB152: 0
A153: ="600570" -> 600570 | B153: 恒生电子 | C153: 9.4199999999999999 | D153: 151482 | E153: 578.27亿 | F153: 2.4500000000000002 | G153: 93.599999999999994 | H153: 93.5 | I153: 93.599999999999994 | J153: 466 | K153: 2.1699999999999999 | L153: 94.049999999999997 | M153: 94.049999999999997 | N153: 90.230000000000004 | O153: 85.540000000000006 | P153: 120.26000000000001 | Q153: 1406981120 | R153: 21.969999999999999 | S153: 软件服务 | T153: 浙江 | U153: 4.4699999999999998 | V153: 92.879999999999995 | W153: 73036 | X153: 78445 | Y153: 0.93000000000000005 | Z153: 130 | AA153: 7 | AB153: 8.0600000000000005
A154: ="300365" -> 300365 | B154: 恒华科技 | C154: 3.3399999999999999 | D154: 11606 | E154: 51.45亿 | F154: 0.53000000000000003 | G154: 23.539999999999999 | H154: 23.539999999999999 | I154: 23.550000000000001 | J154: 1 | K154: -0.67000000000000004 | L154: 23.25 | M154: 23.800000000000001 | N154: 22.98 | O154: 22.780000000000001 | P154: 64.530000000000001 | Q154: 27194572 | R154: 7.2400000000000002 | S154: 软件服务 | T154: 北京 | U154: 3.6000000000000001 | V154: 23.43 | W154: 6255 | X154: 5351 | Y154: 1.1699999999999999 | Z154: 14 | AA154: 193 | AB154: 0.76000000000000001
A155: ="600845" -> 600845 | B155: 宝信软件 | C155: 0.37 | D155: 9409 | E155: 192.25亿 | F155: 0.14999999999999999 | G155: 30 | H155: 30 | I155: 30.09 | J155: 138 | K155: 2.3900000000000001 | L155: 29.850000000000001 | M155: 30 | N155: 29.25 | O155: 29.890000000000001 | P155: 38.07 | Q155: 27851884 | R155: 3.1899999999999999 | S155: 软件服务 | T155: 上海 | U155: 2.5099999999999998 | V155: 29.600000000000001 | W155: 4208 | X155: 5200 | Y155: 0.81000000000000005 | Z155: 177 | AA155: 21 | AB155: 0.11
A156: ="600728" -> 600728 | B156: 佳都科技 | C156: -0.10000000000000001 | D156: 62146 | E156: 161.54亿 | F156: 0.39000000000000001 | G156: 10.07 | H156: 10.07 | I156: 10.08 | J156: 57 | K156: 1.6100000000000001 | L156: 9.9900000000000002 | M156: 10.08 | N156: 9.9000000000000004 | O156: 10.08 | P156: 108.56 | Q156: 61848852 | R156: 2.73 | S156: 软件服务 | T156: 广东 | U156: 1.79 | V156: 9.9499999999999993 | W156: 27385 | X156: 34761 | Y156: 0.79000000000000004 | Z156: 1184 | AA156: 341 | AB156: -0.01
A157: ="600406" -> 600406 | B157: 国电南瑞 | C157: -0.94999999999999996 | D157: 28893 | E157: 508.09亿 | F157: 0.11 | G157: 19.899999999999999 | H157: 19.890000000000001 | I157: 19.899999999999999 | J157: 21 | K157: 0.60999999999999999 | L157: 20 | M157: 20 | N157: 19.75 | O157: 20.09 | P157: 29.539999999999999 | Q157: 57298900 | R157: 2.8500000000000001 | S157: 软件服务 | T157: 江苏 | U157: 1.24 | V157: 19.829999999999998 | W157: 13598 | X157: 15295 | Y157: 0.89000000000000001 | Z157: 86 | AA157: 155 | AB157: -0.19
A158: ="300275" -> 300275 | B158: 梅安森 | C158: -1.03 | D158: 7325 | E158: 10.17亿 | F158: 0.62 | G158: 8.6500000000000004 | H158: 8.6500000000000004 | I158: 8.6600000000000001 | J158: 4 | K158: -0.11 | L158: 8.6699999999999999 | M158: 8.7100000000000009 | N158: 8.6400000000000006 | O158: 8.7400000000000002 | P158: 70.739999999999995 | Q158: 6345949 | R158: 4.5 | S158: 软件服务 | T158: 重庆 | U158: 0.80000000000000004 | V158: 8.6600000000000001 | W158: 5716 | X158: 1609 | Y158: 3.5499999999999998 | Z158: 214 | AA158: 71 | AB158: -0.089999999999999997
A159: ="300290" -> 300290 | B159: 荣科科技 | C159: -1.29 | D159: 8349 | E159: 24.47亿 | F159: 0.26000000000000001 | G159: 7.6299999999999999 | H159: 7.6200000000000001 | I159: 7.6500000000000004 | J159: 3 | K159: 0.39000000000000001 | L159: 7.7199999999999998 | M159: 7.7199999999999998 | N159: 7.5599999999999996 | O159: 7.7300000000000004 | P159: 218.62000000000001 | Q159: 6365959 | R159: 2.8300000000000001 | S159: 软件服务 | T159: 辽宁 | U159: 2.0699999999999998 | V159: 7.6200000000000001 | W159: 5425 | X159: 2924 | Y159: 1.8600000000000001 | Z159: 33 | AA159: 131 | AB159: -0.10000000000000001
A160: ="600588" -> 600588 | B160: 用友网络 | C160: -1.5900000000000001 | D160: 37604 | E160: 586.68亿 | F160: 0.20000000000000001 | G160: 30.850000000000001 | H160: 30.850000000000001 | I160: 30.890000000000001 | J160: 709 | K160: 0.059999999999999998 | L160: 31.34 | M160: 31.34 | N160: 30.399999999999999 | O160: 31.350000000000001 | P160: 294.19999999999999 | Q160: 116298992 | R160: 3.2799999999999998 | S160: 软件服务 | T160: 北京 | U160: 3 | V160: 30.93 | W160: 21183 | X160: 16420 | Y160: 1.29 | Z160: 8 | AA160: 218 | AB160: -0.5
A161: ="600536" -> 600536 | B161: 中国软件 | C161: -1.8999999999999999 | D161: 52516 | E161: 140.21亿 | F161: 1.0600000000000001 | G161: 28.350000000000001 | H161: 28.350000000000001 | I161: 28.379999999999999 | J161: 265 | K161: 0.070000000000000007 | L161: 28.809999999999999 | M161: 28.809999999999999 | N161: 28.09 | O161: 28.899999999999999 | P161: -- | Q161: 149318480 | R161: 2.8700000000000001 | S161: 软件服务 | T161: 北京 | U161: 2.4900000000000002 | V161: 28.43 | W161: 25787 | X161: 26728 | Y161: 0.95999999999999996 | Z161: 431 | AA161: 9 | AB161: -0.55000000000000004
A162: ="600500" -> 600500 | B162: 中化国际 | C162: 0.65000000000000002 | D162: 26655 | E162: 161.02亿 | F162: 0.13 | G162: 7.7300000000000004 | H162: 7.7199999999999998 | I162: 7.7300000000000004 | J162: 595 | K162: 0.91000000000000003 | L162: 7.6699999999999999 | M162: 7.7400000000000002 | N162: 7.6299999999999999 | O162: 7.6799999999999997 | P162: 15.630000000000001 | Q162: 20451784 | R162: 3.7000000000000002 | S162: 商贸代理 | T162: 上海 | U162: 1.4299999999999999 | V162: 7.6699999999999999 | W162: 11557 | X162: 15098 | Y162: 0.77000000000000002 | Z162: 232 | AA162: 67 | AB162: 0.050000000000000003
A163: ="300122" -> 300122 | B163: 智飞生物 | C163: 4.71 | D163: 34456 | E163: 386.08亿 | F163: 0.40000000000000002 | G163: 44.420000000000002 | H163: 44.399999999999999 | I163: 44.420000000000002 | J163: 222 | K163: 2.1400000000000001 | L163: 42.799999999999997 | M163: 44.549999999999997 | N163: 42.799999999999997 | O163: 42.420000000000002 | P163: 49.060000000000002 | Q163: 150722272 | R163: 7.1299999999999999 | S163: 生物制药 | T163: 重庆 | U163: 4.1299999999999999 | V163: 43.740000000000002 | W163: 14910 | X163: 19546 | Y163: 0.76000000000000001 | Z163: 8 | AA163: 18 | AB163: 2
A164: ="300009" -> 300009 | B164: 安科生物 | C164: 0.47999999999999998 | D164: 20805 | E164: 100.01亿 | F164: 0.31 | G164: 14.67 | H164: 14.66 | I164: 14.67 | J164: 41 | K164: 0.62 | L164: 14.699999999999999 | M164: 14.77 | N164: 14.5 | O164: 14.6 | P164: 47.390000000000001 | Q164: 30498700 | R164: 3.6800000000000002 | S164: 生物制药 | T164: 安徽 | U164: 1.8500000000000001 | V164: 14.66 | W164: 10340 | X164: 10465 | Y164: 0.98999999999999999 | Z164: 236 | AA164: 39 | AB164: 0.070000000000000007
A165: ="300289" -> 300289 | B165: 利德曼 | C165: 0.40999999999999998 | D165: 3729 | E165: 30.80亿 | F165: 0.089999999999999997 | G165: 7.3799999999999999 | H165: 7.3700000000000001 | I165: 7.3799999999999999 | J165: 14 | K165: 0.68000000000000005 | L165: 7.3899999999999997 | M165: 7.3899999999999997 | N165: 7.2999999999999998 | O165: 7.3499999999999996 | P165: 38.109999999999999 | Q165: 2740813 | R165: 1.3899999999999999 | S165: 生物制药 | T165: 北京 | U165: 1.22 | V165: 7.3499999999999996 | W165: 1917 | X165: 1812 | Y165: 1.0600000000000001 | Z165: 111 | AA165: 307 | AB165: 0.029999999999999999
A166: ="000661" -> 000661 | B166: 长春高新 | C166: -- | D166: 0 | E166: 384.18亿 | F166: 0 | G166: 226.05000000000001 | I166: -- | J166: 0 | K166: -- | L166: -- | M166: -- | N166: -- | O166: 226.05000000000001 | P166: 34.390000000000001 | Q166: 0 | R166: 0 | S166: 生物制药 | T166: 吉林 | U166: 0 | V166: 226.05000000000001 | W166: 0 | X166: 0 | Y166: -- | Z166: 0 | AA166: 0 | AB166: --
A167: ="300119" -> 300119 | B167: 瑞普生物 | C167: -0.11 | D167: 2790 | E167: 18.26亿 | F167: 0.14000000000000001 | G167: 8.9199999999999999 | H167: 8.9000000000000004 | I167: 8.9199999999999999 | J167: 1 | K167: 0.79000000000000004 | L167: 8.9299999999999997 | M167: 8.9299999999999997 | N167: 8.8499999999999996 | O167: 8.9299999999999997 | P167: 25.539999999999999 | Q167: 2478066 | R167: 2.0699999999999998 | S167: 生物制药 | T167: 天津 | U167: 0.90000000000000002 | V167: 8.8800000000000008 | W167: 1742 | X167: 1048 | Y167: 1.6599999999999999 | Z167: 446 | AA167: 2 | AB167: -0.01
A168: ="600028" -> 600028 | B168: 中国石化 | C168: -1.1499999999999999 | D168: 314376 | E168: 5733.47亿 | F168: 0.029999999999999999 | G168: 6 | H168: 5.9900000000000002 | I168: 6 | J168: 3432 | K168: 0.17000000000000001 | L168: 6.0099999999999998 | M168: 6.0099999999999998 | N168: 5.9699999999999998 | O168: 6.0700000000000003 | P168: 9.0800000000000001 | Q168: 188291056 | R168: 7.04 | S168: 石油加工 | T168: 北京 | U168: 0.66000000000000003 | V168: 5.9900000000000002 | W168: 138571 | X168: 175804 | Y168: 0.79000000000000004 | Z168: 4495 | AA168: 2189 | AB168: -0.070000000000000007
A169: ="600872" -> 600872 | B169: 中炬高新 | C169: 0.93999999999999995 | D169: 8068 | E169: 257.31亿 | F169: 0.10000000000000001 | G169: 32.299999999999997 | H169: 32.259999999999998 | I169: 32.299999999999997 | J169: 48 | K169: 0.46999999999999997 | L169: 31.899999999999999 | M169: 32.380000000000003 | N169: 31.699999999999999 | O169: 32 | P169: 39.729999999999997 | Q169: 25909974 | R169: 2.21 | S169: 食品 | T169: 广东 | U169: 2.1299999999999999 | V169: 32.109999999999999 | W169: 2863 | X169: 5205 | Y169: 0.55000000000000004 | Z169: 7 | AA169: 7 | AB169: 0.29999999999999999
A170: ="300146" -> 300146 | B170: 汤臣倍健 | C170: 0.63 | D170: 16944 | E170: 182.30亿 | F170: 0.19 | G170: 20.73 | H170: 20.73 | I170: 20.739999999999998 | J170: 69 | K170: 0.88 | L170: 20.449999999999999 | M170: 20.73 | N170: 20.43 | O170: 20.600000000000001 | P170: 21.579999999999998 | Q170: 34800840 | R170: 3.2999999999999998 | S170: 食品 | T170: 广东 | U170: 1.46 | V170: 20.539999999999999 | W170: 6081 | X170: 10862 | Y170: 0.56000000000000005 | Z170: 35 | AA170: 14 | AB170: 0.13
A171: ="600298" -> 600298 | B171: 安琪酵母 | C171: -0.33000000000000002 | D171: 8145 | E171: 225.39亿 | F171: 0.10000000000000001 | G171: 27.350000000000001 | H171: 27.350000000000001 | I171: 27.370000000000001 | J171: 28 | K171: 0.69999999999999996 | L171: 27.399999999999999 | M171: 27.399999999999999 | N171: 27.09 | O171: 27.440000000000001 | P171: 25.09 | Q171: 22178016 | R171: 2.9900000000000002 | S171: 食品 | T171: 湖北 | U171: 1.1299999999999999 | V171: 27.23 | W171: 3833 | X171: 4312 | Y171: 0.89000000000000001 | Z171: 7 | AA171: 26 | AB171: -0.089999999999999997
A172: ="002507" -> 002507 | B172: 涪陵榨菜 | C172: -0.59999999999999998 | D172: 8980 | E172: 194.94亿 | F172: 0.12 | G172: 25 | H172: 25 | I172: 25.010000000000002 | J172: 4 | K172: 0.40000000000000002 | L172: 25.140000000000001 | M172: 25.140000000000001 | N172: 24.82 | O172: 25.149999999999999 | P172: 28.289999999999999 | Q172: 22385552 | R172: 2.3399999999999999 | S172: 食品 | T172: 重庆 | U172: 1.27 | V172: 24.93 | W172: 4574 | X172: 4405 | Y172: 1.04 | Z172: 70 | AA172: 9 | AB172: -0.14999999999999999
A173: ="603288" -> 603288 | B173: 海天味业 | C173: -0.69999999999999996 | D173: 4309 | E173: 2102.24亿 | F173: 0.02 | G173: 77.849999999999994 | H173: 77.799999999999997 | I173: 77.849999999999994 | J173: 26 | K173: -0.68999999999999995 | L173: 77.510000000000005 | M173: 78.5 | N173: 77.510000000000005 | O173: 78.400000000000006 | P173: 50.350000000000001 | Q173: 33622496 | R173: 3.0499999999999998 | S173: 食品 | T173: 广东 | U173: 1.26 | V173: 78.040000000000006 | W173: 1579 | X173: 2729 | Y173: 0.57999999999999996 | Z173: 5 | AA173: 1 | AB173: -0.55000000000000004
A174: ="600305" -> 600305 | B174: 恒顺醋业 | C174: -1.44 | D174: 27461 | E174: 91.13亿 | F174: 0.34999999999999998 | G174: 11.630000000000001 | H174: 11.59 | I174: 11.630000000000001 | J174: 178 | K174: 0.52000000000000002 | L174: 11.68 | M174: 11.710000000000001 | N174: 11.52 | O174: 11.800000000000001 | P174: 31.309999999999999 | Q174: 31873402 | R174: 3.9900000000000002 | S174: 食品 | T174: 江苏 | U174: 1.6100000000000001 | V174: 11.609999999999999 | W174: 13926 | X174: 13535 | Y174: 1.03 | Z174: 16 | AA174: 27 | AB174: -0.17000000000000001
A175: ="002557" -> 002557 | B175: 洽洽食品 | C175: -1.6499999999999999 | D175: 6004 | E175: 106.01亿 | F175: 0.12 | G175: 20.91 | H175: 20.940000000000001 | I175: 20.949999999999999 | J175: 26 | K175: 0.14000000000000001 | L175: 21.219999999999999 | M175: 21.219999999999999 | N175: 20.84 | O175: 21.260000000000002 | P175: 26.260000000000002 | Q175: 12588996 | R175: 2.3199999999999998 | S175: 食品 | T175: 安徽 | U175: 1.79 | V175: 20.969999999999999 | W175: 3361 | X175: 2643 | Y175: 1.27 | Z175: 2 | AA175: 143 | AB175: -0.34999999999999998
A176: ="002330" -> 002330 | B176: 得利斯 | C176: -2.79 | D176: 22138 | E176: 26.25亿 | F176: 0.44 | G176: 5.2300000000000004 | H176: 5.2300000000000004 | I176: 5.2400000000000002 | J176: 10 | K176: 0.57999999999999996 | L176: 5.2999999999999998 | M176: 5.2999999999999998 | N176: 5.1799999999999997 | O176: 5.3799999999999999 | P176: 364.20999999999998 | Q176: 11534296 | R176: 3.3799999999999999 | S176: 食品 | T176: 山东 | U176: 2.23 | V176: 5.21 | W176: 11974 | X176: 10164 | Y176: 1.1799999999999999 | Z176: 487 | AA176: 100 | AB176: -0.14999999999999999
A177: ="600131" -> 600131 | B177: 岷江水电 | C177: 10.02 | D177: 54733 | E177: 54.14亿 | F177: 1.3400000000000001 | G177: 13.279999999999999 | H177: 13.279999999999999 | I177: -- | J177: 6 | K177: 0 | L177: 13.279999999999999 | M177: 13.279999999999999 | N177: 13.279999999999999 | O177: 12.07 | P177: 45.710000000000001 | Q177: 72685064 | R177: 16.800000000000001 | S177: 水力发电 | T177: 四川 | U177: 0 | V177: 13.279999999999999 | W177: 39391 | X177: 15341 | Y177: 2.5699999999999998 | Z177: 136244 | AA177: 0 | AB177: 1.21
A178: ="600452" -> 600452 | B178: 涪陵电力 | C178: 1.6599999999999999 | D178: 2928 | E178: 49.30亿 | F178: 0.13 | G178: 22.010000000000002 | H178: 22.010000000000002 | I178: 22.030000000000001 | J178: 9 | K178: 2.8500000000000001 | L178: 21.649999999999999 | M178: 22.010000000000002 | N178: 21.370000000000001 | O178: 21.649999999999999 | P178: 17.57 | Q178: 6332550 | R178: 2.73 | S178: 水力发电 | T178: 重庆 | U178: 2.96 | V178: 21.629999999999999 | W178: 978 | X178: 1949 | Y178: 0.5 | Z178: 18 | AA178: 13 | AB178: 0.35999999999999999
A179: ="600900" -> 600900 | B179: 长江电力 | C179: 0 | D179: 35528 | E179: 1884.67亿 | F179: 0.029999999999999999 | G179: 16.379999999999999 | H179: 16.359999999999999 | I179: 16.370000000000001 | J179: 130 | K179: 0 | L179: 16.300000000000001 | M179: 16.390000000000001 | N179: 16.260000000000002 | O179: 16.379999999999999 | P179: 15.08 | Q179: 58016684 | R179: 3.9500000000000002 | S179: 水力发电 | T179: 北京 | U179: 0.79000000000000004 | V179: 16.329999999999998 | W179: 16270 | X179: 19258 | Y179: 0.83999999999999997 | Z179: 332 | AA179: 78 | AB179: 0
A180: ="600674" -> 600674 | B180: 川投能源 | C180: -0.22 | D180: 14420 | E180: 407.64亿 | F180: 0.029999999999999999 | G180: 9.2599999999999998 | H180: 9.2599999999999998 | I180: 9.2699999999999996 | J180: 5 | K180: 0 | L180: 9.2799999999999994 | M180: 9.2799999999999994 | N180: 9.2100000000000009 | O180: 9.2799999999999994 | P180: 11.029999999999999 | Q180: 13338982 | R180: 2.71 | S180: 水力发电 | T180: 四川 | U180: 0.75 | V180: 9.25 | W180: 5565 | X180: 8854 | Y180: 0.63 | Z180: 245 | AA180: 3 | AB180: -0.02
A181: ="600116" -> 600116 | B181: 三峡水利 | C181: -0.35999999999999999 | D181: 11233 | E181: 83.11亿 | F181: 0.11 | G181: 8.3699999999999992 | H181: 8.3399999999999999 | I181: 8.3699999999999992 | J181: 489 | K181: 0.83999999999999997 | L181: 8.3900000000000006 | M181: 8.4199999999999999 | N181: 8.2599999999999998 | O181: 8.4000000000000004 | P181: 35.68 | Q181: 9393228 | R181: 3.71 | S181: 水力发电 | T181: 重庆 | U181: 1.8999999999999999 | V181: 8.3599999999999994 | W181: 6212 | X181: 5021 | Y181: 1.24 | Z181: 63 | AA181: 32 | AB181: -0.029999999999999999
A182: ="600886" -> 600886 | B182: 国投电力 | C182: -0.58999999999999997 | D182: 45121 | E182: 570.03亿 | F182: 0.070000000000000007 | G182: 8.4000000000000004 | H182: 8.3900000000000006 | I182: 8.4000000000000004 | J182: 199 | K182: 0.35999999999999999 | L182: 8.4000000000000004 | M182: 8.4000000000000004 | N182: 8.3499999999999996 | O182: 8.4499999999999993 | P182: 11.890000000000001 | Q182: 37789880 | R182: 3.3700000000000001 | S182: 水力发电 | T182: 北京 | U182: 0.58999999999999997 | V182: 8.3800000000000008 | W182: 19290 | X182: 25831 | Y182: 0.75 | Z182: 191 | AA182: 431 | AB182: -0.050000000000000003
A183: ="600236" -> 600236 | B183: 桂冠电力 | C183: -0.84999999999999998 | D183: 18573 | E183: 354.10亿 | F183: 0.029999999999999999 | G183: 5.8399999999999999 | H183: 5.8300000000000001 | I183: 5.8399999999999999 | J183: 208 | K183: 0.34000000000000002 | L183: 5.8700000000000001 | M183: 5.8700000000000001 | N183: 5.8099999999999996 | O183: 5.8899999999999997 | P183: 13.199999999999999 | Q183: 10832853 | R183: 3.9500000000000002 | S183: 水力发电 | T183: 广西 | U183: 1.02 | V183: 5.8300000000000001 | W183: 9131 | X183: 9441 | Y183: 0.96999999999999997 | Z183: 580 | AA183: 338 | AB183: -0.050000000000000003
A184: ="000722" -> 000722 | B184: 湖南发展 | C184: -1.28 | D184: 16919 | E184: 32.31亿 | F184: 0.35999999999999999 | G184: 6.96 | H184: 6.96 | I184: 6.9800000000000004 | J184: 338 | K184: 0.71999999999999997 | L184: 7.1600000000000001 | M184: 7.1699999999999999 | N184: 6.8799999999999999 | O184: 7.0499999999999998 | P184: 30.879999999999999 | Q184: 11813932 | R184: 2.5099999999999998 | S184: 水力发电 | T184: 湖南 | U184: 4.1100000000000003 | V184: 6.9800000000000004 | W184: 9517 | X184: 7402 | Y184: 1.29 | Z184: 380 | AA184: 382 | AB184: -0.089999999999999997
A185: ="000877" -> 000877 | B185: 天山股份 | C185: 0.57999999999999996 | D185: 33158 | E185: 76.83亿 | F185: 0.38 | G185: 8.7300000000000004 | H185: 8.7300000000000004 | I185: 8.7400000000000002 | J185: 291 | K185: 1.28 | L185: 8.7899999999999991 | M185: 8.7899999999999991 | N185: 8.5800000000000001 | O185: 8.6799999999999997 | P185: 8.9700000000000006 | Q185: 28776782 | R185: 3.6499999999999999 | S185: 水泥 | T185: 新疆 | U185: 2.4199999999999999 | V185: 8.6799999999999997 | W185: 16533 | X185: 16625 | Y185: 0.98999999999999999 | Z185: 540 | AA185: 115 | AB185: 0.050000000000000003
A186: ="000672" -> 000672 | B186: 上峰水泥 | C186: -0.94999999999999996 | D186: 27344 | E186: 76.48亿 | F186: 0.34000000000000002 | G186: 9.4000000000000004 | H186: 9.3900000000000006 | I186: 9.4000000000000004 | J186: 266 | K186: 0.53000000000000003 | L186: 9.4499999999999993 | M186: 9.4600000000000009 | N186: 9.3300000000000001 | O186: 9.4900000000000002 | P186: 6.25 | Q186: 25652808 | R186: 4.0599999999999996 | S186: 水泥 | T186: 甘肃 | U186: 1.3700000000000001 | V186: 9.3800000000000008 | W186: 16093 | X186: 11251 | Y186: 1.4299999999999999 | Z186: 675 | AA186: 274 | AB186: -0.089999999999999997
A187: ="000789" -> 000789 | B187: 万年青 | C187: -1.1200000000000001 | D187: 23810 | E187: 75.56亿 | F187: 0.39000000000000001 | G187: 12.32 | H187: 12.33 | I187: 12.34 | J187: 442 | K187: 0.73999999999999999 | L187: 12.359999999999999 | M187: 12.359999999999999 | N187: 12.199999999999999 | O187: 12.460000000000001 | P187: 6.5 | Q187: 29214018 | R187: 3.8500000000000001 | S187: 水泥 | T187: 江西 | U187: 1.28 | V187: 12.27 | W187: 13071 | X187: 10738 | Y187: 1.22 | Z187: 20 | AA187: 78 | AB187: -0.14000000000000001
A188: ="600801" -> 600801 | B188: 华新水泥 | C188: -1.3200000000000001 | D188: 22559 | E188: 181.91亿 | F188: 0.23000000000000001 | G188: 18.699999999999999 | H188: 18.690000000000001 | I188: 18.699999999999999 | J188: 181 | K188: 0.58999999999999997 | L188: 18.84 | M188: 18.84 | N188: 18.579999999999998 | O188: 18.949999999999999 | P188: 6.1600000000000001 | Q188: 42084932 | R188: 3.8999999999999999 | S188: 水泥 | T188: 湖北 | U188: 1.3700000000000001 | V188: 18.66 | W188: 11031 | X188: 11528 | Y188: 0.95999999999999996 | Z188: 58 | AA188: 737 | AB188: -0.25
A189: ="000401" -> 000401 | B189: 冀东水泥 | C189: -1.77 | D189: 63031 | E189: 193.86亿 | F189: 0.46999999999999997 | G189: 14.390000000000001 | H189: 14.380000000000001 | I189: 14.390000000000001 | J189: 88 | K189: 0.69999999999999996 | L189: 14.41 | M189: 14.41 | N189: 14.210000000000001 | O189: 14.65 | P189: 10.279999999999999 | Q189: 90285736 | R189: 3.7799999999999998 | S189: 水泥 | T189: 河北 | U189: 1.3700000000000001 | V189: 14.32 | W189: 35431 | X189: 27599 | Y189: 1.28 | Z189: 397 | AA189: 357 | AB189: -0.26000000000000001
A190: ="600187" -> 600187 | B190: 国中水务 | C190: 0.94999999999999996 | D190: 62944 | E190: 46.43亿 | F190: 0.42999999999999999 | G190: 3.1899999999999999 | H190: 3.1899999999999999 | I190: 3.2000000000000002 | J190: 474 | K190: 1.5900000000000001 | L190: 3.1800000000000002 | M190: 3.2000000000000002 | N190: 3.1299999999999999 | O190: 3.1600000000000001 | P190: 416.41000000000002 | Q190: 19948500 | R190: 4.5800000000000001 | S190: 水务 | T190: 黑龙江 | U190: 2.2200000000000002 | V190: 3.1699999999999999 | W190: 32330 | X190: 30614 | Y190: 1.0600000000000001 | Z190: 524 | AA190: 3117 | AB190: 0.029999999999999999
A191: ="600026" -> 600026 | B191: 中远海能 | C191: 1.19 | D191: 35225 | E191: 162.79亿 | F191: 0.13 | G191: 5.9500000000000002 | H191: 5.9299999999999997 | I191: 5.9500000000000002 | J191: 61 | K191: 2.23 | L191: 5.79 | M191: 5.9699999999999998 | N191: 5.75 | O191: 5.8799999999999999 | P191: -- | Q191: 20554420 | R191: 3.0899999999999999 | S191: 水运 | T191: 上海 | U191: 3.7400000000000002 | V191: 5.8399999999999999 | W191: 14863 | X191: 20361 | Y191: 0.72999999999999998 | Z191: 2 | AA191: 28 | AB191: 0.070000000000000007
A192: ="002320" -> 002320 | B192: 海峡股份 | C192: 0.14000000000000001 | D192: 9148 | E192: 82.64亿 | F192: 0.16 | G192: 14.800000000000001 | H192: 14.779999999999999 | I192: 14.800000000000001 | J192: 10 | K192: 0.75 | L192: 14.890000000000001 | M192: 14.91 | N192: 14.6 | O192: 14.779999999999999 | P192: 34.770000000000003 | Q192: 13496418 | R192: 2.3999999999999999 | S192: 水运 | T192: 海南 | U192: 2.1000000000000001 | V192: 14.75 | W192: 5020 | X192: 4127 | Y192: 1.22 | Z192: 20 | AA192: 56 | AB192: 0.02
A193: ="000876" -> 000876 | B193: 新 希 望 | C193: 3.8100000000000001 | D193: 133409 | E193: 454.70亿 | F193: 0.32000000000000001 | G193: 10.890000000000001 | H193: 10.880000000000001 | I193: 10.890000000000001 | J193: 2957 | K193: 2.9300000000000002 | L193: 10.33 | M193: 10.93 | N193: 10.33 | O193: 10.49 | P193: 23.739999999999998 | Q193: 141256096 | R193: 4.46 | S193: 饲料 | T193: 四川 | U193: 5.7199999999999998 | V193: 10.59 | W193: 42192 | X193: 91216 | Y193: 0.46000000000000002 | Z193: 241 | AA193: 220 | AB193: 0.40000000000000002
A194: ="002157" -> 002157 | B194: 正邦科技 | C194: 2.0800000000000001 | D194: 220310 | E194: 243.88亿 | F194: 1.02 | G194: 11.289999999999999 | H194: 11.27 | I194: 11.289999999999999 | J194: 326 | K194: -0.68999999999999995 | L194: 10.83 | M194: 11.42 | N194: 10.83 | O194: 11.060000000000001 | P194: 569.19000000000005 | Q194: 245543120 | R194: 5.4199999999999999 | S194: 饲料 | T194: 江西 | U194: 5.3300000000000001 | V194: 11.15 | W194: 93763 | X194: 126547 | Y194: 0.73999999999999999 | Z194: 212 | AA194: 41 | AB194: 0.23000000000000001
A195: ="002124" -> 002124 | B195: 天邦股份 | C195: 1.23 | D195: 65853 | E195: 122.36亿 | F195: 0.62 | G195: 11.560000000000001 | H195: 11.560000000000001 | I195: 11.58 | J195: 173 | K195: 2.21 | L195: 11.24 | M195: 11.6 | N195: 11.210000000000001 | O195: 11.42 | P195: 83.200000000000003 | Q195: 74906856 | R195: 4.04 | S195: 饲料 | T195: 浙江 | U195: 3.4199999999999999 | V195: 11.369999999999999 | W195: 30450 | X195: 35402 | Y195: 0.85999999999999999 | Z195: 16 | AA195: 110 | AB195: 0.14000000000000001
A196: ="002311" -> 002311 | B196: 海大集团 | C196: -0.73999999999999999 | D196: 4936 | E196: 417.05亿 | F196: 0.029999999999999999 | G196: 27 | H196: 26.989999999999998 | I196: 27 | J196: 4 | K196: 0.37 | L196: 27 | M196: 27.100000000000001 | N196: 26.670000000000002 | O196: 27.199999999999999 | P196: 25.190000000000001 | Q196: 13281409 | R196: 1.01 | S196: 饲料 | T196: 广东 | U196: 1.5800000000000001 | V196: 26.91 | W196: 2568 | X196: 2368 | Y196: 1.0800000000000001 | Z196: 17 | AA196: 201 | AB196: -0.20000000000000001
A197: ="002567" -> 002567 | B197: 唐人神 | C197: -1.1299999999999999 | D197: 23063 | E197: 66.48亿 | F197: 0.29999999999999999 | G197: 8.7799999999999994 | H197: 8.7799999999999994 | I197: 8.7899999999999991 | J197: 86 | K197: 0.92000000000000004 | L197: 8.7300000000000004 | M197: 8.8000000000000007 | N197: 8.6099999999999994 | O197: 8.8800000000000008 | P197: 43.409999999999997 | Q197: 20097660 | R197: 1.3700000000000001 | S197: 饲料 | T197: 湖南 | U197: 2.1400000000000001 | V197: 8.7100000000000009 | W197: 11287 | X197: 11775 | Y197: 0.95999999999999996 | Z197: 157 | AA197: 77 | AB197: -0.10000000000000001
A198: ="002243" -> 002243 | B198: 通产丽星 | C198: 0.25 | D198: 156173 | E198: 89.38亿 | F198: 4.2800000000000002 | G198: 24.489999999999998 | H198: 24.48 | I198: 24.5 | J198: 844 | K198: -1.95 | L198: 26 | M198: 26.699999999999999 | N198: 21.989999999999998 | O198: 24.43 | P198: 123.45999999999999 | Q198: 388714496 | R198: 7.5800000000000001 | S198: 塑料 | T198: 深圳 | U198: 19.280000000000001 | V198: 24.890000000000001 | W198: 70999 | X198: 85174 | Y198: 0.82999999999999996 | Z198: 141 | AA198: 256 | AB198: 0.059999999999999998
A199: ="002522" -> 002522 | B199: 浙江众成 | C199: -0.38 | D199: 16072 | E199: 44.43亿 | F199: 0.19 | G199: 5.2400000000000002 | H199: 5.2300000000000004 | I199: 5.2400000000000002 | J199: 57 | K199: 0.38 | L199: 5.25 | M199: 5.2699999999999996 | N199: 5.2000000000000002 | O199: 5.2599999999999998 | P199: 95.260000000000005 | Q199: 8417727 | R199: 3.2000000000000002 | S199: 塑料 | T199: 浙江 | U199: 1.3300000000000001 | V199: 5.2400000000000002 | W199: 7271 | X199: 8801 | Y199: 0.82999999999999996 | Z199: 993 | AA199: 43 | AB199: -0.02
A200: ="600143" -> 600143 | B200: 金发科技 | C200: -0.93000000000000005 | D200: 37225 | E200: 135.68亿 | F200: 0.14999999999999999 | G200: 5.2999999999999998 | H200: 5.2999999999999998 | I200: 5.3099999999999996 | J200: 204 | K200: 0.19 | L200: 5.3200000000000003 | M200: 5.3399999999999999 | N200: 5.25 | O200: 5.3499999999999996 | P200: 16.510000000000002 | Q200: 19688992 | R200: 3.73 | S200: 塑料 | T200: 广东 | U200: 1.6799999999999999 | V200: 5.29 | W200: 21312 | X200: 15913 | Y200: 1.3400000000000001 | Z200: 215 | AA200: 871 | AB200: -0.050000000000000003
A201: ="000825" -> 000825 | B201: 太钢不锈 | C201: -0.20000000000000001 | D201: 122237 | E201: 283.09亿 | F201: 0.20999999999999999 | G201: 4.9699999999999998 | H201: 4.96 | I201: 4.9699999999999998 | J201: 320 | K201: 1.6399999999999999 | L201: 4.9800000000000004 | M201: 4.9800000000000004 | N201: 4.8899999999999997 | O201: 4.9800000000000004 | P201: 5.2300000000000004 | Q201: 60268520 | R201: 6.0999999999999996 | S201: 特种钢 | T201: 山西 | U201: 1.8100000000000001 | V201: 4.9299999999999997 | W201: 66980 | X201: 55257 | Y201: 1.21 | Z201: 2505 | AA201: 2663 | AB201: -0.01
A202: ="600507" -> 600507 | B202: 方大特钢 | C202: -1.22 | D202: 72432 | E202: 182.74亿 | F202: 0.55000000000000004 | G202: 13.779999999999999 | H202: 13.779999999999999 | I202: 13.789999999999999 | J202: 130 | K202: 1.25 | L202: 13.699999999999999 | M202: 13.789999999999999 | N202: 13.550000000000001 | O202: 13.949999999999999 | P202: 6.8300000000000001 | Q202: 98875344 | R202: 3.23 | S202: 特种钢 | T202: 江西 | U202: 1.72 | V202: 13.65 | W202: 32286 | X202: 40145 | Y202: 0.80000000000000004 | Z202: 38 | AA202: 534 | AB202: -0.17000000000000001
A203: ="601006" -> 601006 | B203: 大秦铁路 | C203: 0.56000000000000005 | D203: 69651 | E203: 1339.50亿 | F203: 0.050000000000000003 | G203: 9.0099999999999998 | H203: 9 | I203: 9.0099999999999998 | J203: 362 | K203: 0.67000000000000004 | L203: 8.9600000000000009 | M203: 9.0199999999999996 | N203: 8.9100000000000001 | O203: 8.9600000000000009 | P203: 8.2799999999999994 | Q203: 62385352 | R203: 4.96 | S203: 铁路 | T203: 山西 | U203: 1.23 | V203: 8.9600000000000009 | W203: 27401 | X203: 42250 | Y203: 0.65000000000000002 | Z203: 2939 | AA203: 169 | AB203: 0.050000000000000003
A204: ="000070" -> 000070 | B204: 特发信息 | C204: 9.2200000000000006 | D204: 246350 | E204: 94.55亿 | F204: 4.0999999999999996 | G204: 15.75 | H204: 15.710000000000001 | I204: 15.75 | J204: 1345 | K204: -0.68000000000000005 | L204: 15.859999999999999 | M204: 15.859999999999999 | N204: 15.1 | O204: 14.42 | P204: 45.079999999999998 | Q204: 387688928 | R204: 14.44 | S204: 通信设备 | T204: 深圳 | U204: 5.2699999999999996 | V204: 15.74 | W204: 177743 | X204: 68607 | Y204: 2.5899999999999999 | Z204: 10 | AA204: 241 | AB204: 1.3300000000000001
A205: ="600776" -> 600776 | B205: 东方通信 | C205: 8.9000000000000004 | D205: 318709 | E205: 350.85亿 | F205: 3.3300000000000001 | G205: 36.700000000000003 | H205: 36.700000000000003 | I205: 36.75 | J205: 1142 | K205: 1.1000000000000001 | L205: 37.07 | M205: 37.07 | N205: 34.140000000000001 | O205: 33.700000000000003 | P205: 450.73000000000002 | Q205: 1154206848 | R205: 8.2699999999999996 | S205: 通信设备 | T205: 浙江 | U205: 8.6899999999999995 | V205: 36.219999999999999 | W205: 173148 | X205: 145560 | Y205: 1.19 | Z205: 115 | AA205: 98 | AB205: 3
A206: ="002446" -> 002446 | B206: 盛路通信 | C206: 2.3199999999999998 | D206: 173820 | E206: 46.18亿 | F206: 3.8199999999999998 | G206: 10.16 | H206: 10.16 | I206: 10.19 | J206: 145 | K206: 0.58999999999999997 | L206: 10.18 | M206: 10.26 | N206: 9.9800000000000004 | O206: 9.9299999999999997 | P206: 47.909999999999997 | Q206: 176045776 | R206: 5.9699999999999998 | S206: 通信设备 | T206: 广东 | U206: 2.8199999999999998 | V206: 10.130000000000001 | W206: 74964 | X206: 98855 | Y206: 0.76000000000000001 | Z206: 1416 | AA206: 609 | AB206: 0.23000000000000001
A207: ="600105" -> 600105 | B207: 永鼎股份 | C207: -2.1000000000000001 | D207: 62693 | E207: 69.22亿 | F207: 0.51000000000000001 | G207: 5.5899999999999999 | H207: 5.5899999999999999 | I207: 5.5999999999999996 | J207: 134 | K207: 0.71999999999999997 | L207: 5.7300000000000004 | M207: 5.7300000000000004 | N207: 5.5199999999999996 | O207: 5.71 | P207: 49.219999999999999 | Q207: 34986916 | R207: 2.4700000000000002 | S207: 通信设备 | T207: 江苏 | U207: 3.6800000000000002 | V207: 5.5800000000000001 | W207: 33593 | X207: 29099 | Y207: 1.1499999999999999 | Z207: 341 | AA207: 329 | AB207: -0.12
A208: ="002115" -> 002115 | B208: 三维通信 | C208: -2.4500000000000002 | D208: 49961 | E208: 46.81亿 | F208: 1.3600000000000001 | G208: 12.73 | H208: 12.73 | I208: 12.74 | J208: 80 | K208: 0 | L208: 13 | M208: 13 | N208: 12.539999999999999 | O208: 13.050000000000001 | P208: 31.609999999999999 | Q208: 63538732 | R208: 3.21 | S208: 通信设备 | T208: 浙江 | U208: 3.52 | V208: 12.720000000000001 | W208: 27207 | X208: 22754 | Y208: 1.2 | Z208: 21 | AA208: 76 | AB208: -0.32000000000000001
A209: ="600498" -> 600498 | B209: 烽火通信 | C209: -2.73 | D209: 81947 | E209: 369.30亿 | F209: 0.73999999999999999 | G209: 33.5 | H209: 33.5 | I209: 33.530000000000001 | J209: 287 | K209: 0.90000000000000002 | L209: 34 | M209: 34.060000000000002 | N209: 33.130000000000003 | O209: 34.439999999999998 | P209: 46.520000000000003 | Q209: 273898368 | R209: 4.5300000000000002 | S209: 通信设备 | T209: 湖北 | U209: 2.7000000000000002 | V209: 33.420000000000002 | W209: 38170 | X209: 43777 | Y209: 0.87 | Z209: 78 | AA209: 388 | AB209: -0.93999999999999995
A210: ="002281" -> 002281 | B210: 光迅科技 | C210: -3.1499999999999999 | D210: 40068 | E210: 203.27亿 | F210: 0.64000000000000001 | G210: 32.640000000000001 | H210: 32.640000000000001 | I210: 32.649999999999999 | J210: 152 | K210: -0.39000000000000001 | L210: 33.600000000000001 | M210: 33.600000000000001 | N210: 32.530000000000001 | O210: 33.700000000000003 | P210: 60.280000000000001 | Q210: 131393072 | R210: 3.3900000000000001 | S210: 通信设备 | T210: 湖北 | U210: 3.1800000000000002 | V210: 32.789999999999999 | W210: 22131 | X210: 17937 | Y210: 1.23 | Z210: 135 | AA210: 128 | AB210: -1.0600000000000001
A211: ="300312" -> 300312 | B211: 邦讯技术 | C211: -3.27 | D211: 35544 | E211: 16.99亿 | F211: 1.8600000000000001 | G211: 8.8800000000000008 | H211: 8.8800000000000008 | I211: 8.8900000000000006 | J211: 125 | K211: -0.66000000000000003 | L211: 9.0999999999999996 | M211: 9.0999999999999996 | N211: 8.8399999999999999 | O211: 9.1799999999999997 | P211: -- | Q211: 31770296 | R211: 3.4500000000000002 | S211: 通信设备 | T211: 北京 | U211: 2.8300000000000001 | V211: 8.9399999999999995 | W211: 20937 | X211: 14607 | Y211: 1.4299999999999999 | Z211: 189 | AA211: 468 | AB211: -0.29999999999999999
A212: ="300322" -> 300322 | B212: 硕贝德 | C212: -3.4700000000000002 | D212: 78769 | E212: 55.16亿 | F212: 2.1400000000000001 | G212: 15.01 | H212: 15.01 | I212: 15.039999999999999 | J212: 205 | K212: -0.059999999999999998 | L212: 15.220000000000001 | M212: 15.4 | N212: 14.800000000000001 | O212: 15.550000000000001 | P212: 87.260000000000005 | Q212: 119010608 | R212: 5.1299999999999999 | S212: 通信设备 | T212: 广东 | U212: 3.8599999999999999 | V212: 15.109999999999999 | W212: 43321 | X212: 35448 | Y212: 1.22 | Z212: 9 | AA212: 43 | AB212: -0.54000000000000004
A213: ="300081" -> 300081 | B213: 恒信东方 | C213: -0.79000000000000004 | D213: 13426 | E213: 31.60亿 | F213: 0.42999999999999999 | G213: 10.01 | H213: 10 | I213: 10.01 | J213: 155 | K213: 0.29999999999999999 | L213: 10.1 | M213: 10.1 | N213: 9.9600000000000009 | O213: 10.09 | P213: 19.289999999999999 | Q213: 13434665 | R213: 2.5099999999999998 | S213: 文教休闲 | T213: 河北 | U213: 1.3899999999999999 | V213: 10.01 | W213: 7148 | X213: 6278 | Y213: 1.1399999999999999 | Z213: 176 | AA213: 277 | AB213: -0.080000000000000002
A214: ="300282" -> 300282 | B214: 三盛教育 | C214: -2.8300000000000001 | D214: 8998 | E214: 35.92亿 | F214: 0.40000000000000002 | G214: 16.109999999999999 | H214: 16.100000000000001 | I214: 16.109999999999999 | J214: 21 | K214: -0.41999999999999998 | L214: 16.420000000000002 | M214: 16.469999999999999 | N214: 16.100000000000001 | O214: 16.579999999999998 | P214: 35.390000000000001 | Q214: 14617697 | R214: 3.8199999999999998 | S214: 文教休闲 | T214: 北京 | U214: 2.23 | V214: 16.25 | W214: 4937 | X214: 4061 | Y214: 1.22 | Z214: 308 | AA214: 260 | AB214: -0.46999999999999997
A215: ="600456" -> 600456 | B215: 宝钛股份 | C215: 1.48 | D215: 13454 | E215: 85.49亿 | F215: 0.31 | G215: 19.870000000000001 | H215: 19.879999999999999 | I215: 19.890000000000001 | J215: 79 | K215: 2.1099999999999999 | L215: 19.600000000000001 | M215: 19.920000000000002 | N215: 19.300000000000001 | O215: 19.579999999999998 | P215: 66.230000000000004 | Q215: 26408880 | R215: 4.0300000000000002 | S215: 小金属 | T215: 陕西 | U215: 3.1699999999999999 | V215: 19.629999999999999 | W215: 6437 | X215: 7016 | Y215: 0.92000000000000004 | Z215: 37 | AA215: 35 | AB215: 0.28999999999999998
A216: ="000862" -> 000862 | B216: 银星能源 | C216: -6.0599999999999996 | D216: 345342 | E216: 36.50亿 | F216: 6.8899999999999997 | G216: 7.2800000000000002 | H216: 7.2800000000000002 | I216: 7.29 | J216: 736 | K216: 1.3899999999999999 | L216: 7.3300000000000001 | M216: 7.5 | N216: 7.0999999999999996 | O216: 7.75 | P216: 64.540000000000006 | Q216: 252299792 | R216: 4.4500000000000002 | S216: 新型电力 | T216: 宁夏 | U216: 5.1600000000000001 | V216: 7.3099999999999996 | W216: 190764 | X216: 154578 | Y216: 1.23 | Z216: 1002 | AA216: 2906 | AB216: -0.46999999999999997
A217: ="300003" -> 300003 | B217: 乐普医疗 | C217: 9.8300000000000001 | D217: 285381 | E217: 382.61亿 | F217: 1.8799999999999999 | G217: 25.25 | H217: 25.25 | I217: 25.260000000000002 | J217: 356 | K217: 3.3100000000000001 | L217: 24.18 | M217: 25.289999999999999 | N217: 24.030000000000001 | O217: 22.989999999999998 | P217: 29.510000000000002 | Q217: 701789632 | R217: 17.66 | S217: 医疗保健 | T217: 北京 | U217: 5.4800000000000004 | V217: 24.59 | W217: 168125 | X217: 117255 | Y217: 1.4299999999999999 | Z217: 1348 | AA217: 149 | AB217: 2.2599999999999998
A218: ="600763" -> 600763 | B218: 通策医疗 | C218: -0.26000000000000001 | D218: 2238 | E218: 187.80亿 | F218: 0.070000000000000007 | G218: 58.57 | H218: 58.57 | I218: 58.579999999999998 | J218: 3 | K218: 0.71999999999999997 | L218: 58.310000000000002 | M218: 58.57 | N218: 58.049999999999997 | O218: 58.719999999999999 | P218: 51.140000000000001 | Q218: 13043941 | R218: 2.2000000000000002 | S218: 医疗保健 | T218: 浙江 | U218: 0.89000000000000001 | V218: 58.280000000000001 | W218: 1218 | X218: 1020 | Y218: 1.19 | Z218: 1 | AA218: 5 | AB218: -0.14999999999999999
A219: ="002382" -> 002382 | B219: 蓝帆医疗 | C219: -0.94999999999999996 | D219: 3266 | E219: 75.68亿 | F219: 0.070000000000000007 | G219: 15.58 | H219: 15.57 | I219: 15.58 | J219: 1 | K219: 1.1000000000000001 | L219: 15.73 | M219: 15.73 | N219: 15.310000000000001 | O219: 15.73 | P219: 43.229999999999997 | Q219: 5063362 | R219: 2.3300000000000001 | S219: 医疗保健 | T219: 山东 | U219: 2.6699999999999999 | V219: 15.5 | W219: 1685 | X219: 1581 | Y219: 1.0700000000000001 | Z219: 10 | AA219: 1 | AB219: -0.14999999999999999
A220: ="300015" -> 300015 | B220: 爱尔眼科 | C220: -1.05 | D220: 13942 | E220: 612.70亿 | F220: 0.070000000000000007 | G220: 32.149999999999999 | H220: 32.149999999999999 | I220: 32.159999999999997 | J220: 29 | K220: 0.22 | L220: 32.43 | M220: 32.43 | N220: 32 | O220: 32.490000000000002 | P220: 64.219999999999999 | Q220: 44803660 | R220: 3.0899999999999999 | S220: 医疗保健 | T220: 湖南 | U220: 1.3200000000000001 | V220: 32.140000000000001 | W220: 6851 | X220: 7090 | Y220: 0.96999999999999997 | Z220: 24 | AA220: 1 | AB220: -0.34000000000000002
A221: ="600000" -> 600000 | B221: 浦发银行 | C221: 1.5900000000000001 | D221: 149160 | E221: 3403.37亿 | F221: 0.050000000000000003 | G221: 12.109999999999999 | H221: 12.109999999999999 | I221: 12.119999999999999 | J221: 272 | K221: -0.070000000000000007 | L221: 11.91 | M221: 12.15 | N221: 11.82 | O221: 11.92 | P221: 6.1699999999999999 | Q221: 178945648 | R221: 10.289999999999999 | S221: 银行 | T221: 上海 | U221: 2.77 | V221: 12 | W221: 60276 | X221: 88884 | Y221: 0.68000000000000005 | Z221: 49 | AA221: 465 | AB221: 0.19
A222: ="600036" -> 600036 | B222: 招商银行 | C222: 1.1399999999999999 | D222: 117712 | E222: 6784.86亿 | F222: 0.059999999999999998 | G222: 32.890000000000001 | H222: 32.869999999999997 | I222: 32.890000000000001 | J222: 250 | K222: 0.48999999999999999 | L222: 32.289999999999999 | M222: 33 | N222: 32.18 | O222: 32.520000000000003 | P222: 9.2300000000000004 | Q222: 383783680 | R222: 5.6100000000000003 | S222: 银行 | T222: 深圳 | U222: 2.52 | V222: 32.600000000000001 | W222: 58795 | X222: 58917 | Y222: 1 | Z222: 18 | AA222: 99 | AB222: 0.37
A223: ="601818" -> 601818 | B223: 光大银行 | C223: 0.93000000000000005 | D223: 276352 | E223: 1723.80亿 | F223: 0.070000000000000007 | G223: 4.3300000000000001 | H223: 4.3200000000000003 | I223: 4.3300000000000001 | J223: 1919 | K223: 0.69999999999999996 | L223: 4.25 | M223: 4.3300000000000001 | N223: 4.2300000000000004 | O223: 4.29 | P223: 6.1399999999999997 | Q223: 118470240 | R223: 5.8799999999999999 | S223: 银行 | T223: 北京 | U223: 2.3300000000000001 | V223: 4.29 | W223: 106099 | X223: 170252 | Y223: 0.62 | Z223: 2236 | AA223: 1453 | AB223: 0.040000000000000001
A224: ="601166" -> 601166 | B224: 兴业银行 | C224: 0.84999999999999998 | D224: 229802 | E224: 3398.94亿 | F224: 0.12 | G224: 17.84 | H224: 17.829999999999998 | I224: 17.84 | J224: 1483 | K224: 0 | L224: 17.690000000000001 | M224: 17.879999999999999 | N224: 17.510000000000002 | O224: 17.690000000000001 | P224: 5.4900000000000002 | Q224: 407877952 | R224: 7.9100000000000001 | S224: 银行 | T224: 福建 | U224: 2.0899999999999999 | V224: 17.75 | W224: 102000 | X224: 127801 | Y224: 0.80000000000000004 | Z224: 782 | AA224: 595 | AB224: 0.14999999999999999
A225: ="601988" -> 601988 | B225: 中国银行 | C225: 0.26000000000000001 | D225: 539963 | E225: 8198.78亿 | F225: 0.029999999999999999 | G225: 3.8900000000000001 | H225: 3.8799999999999999 | I225: 3.8900000000000001 | J225: 768 | K225: 0.78000000000000003 | L225: 3.8700000000000001 | M225: 3.8900000000000001 | N225: 3.8399999999999999 | O225: 3.8799999999999999 | P225: 5.5999999999999996 | Q225: 208651440 | R225: 7.3499999999999996 | S225: 银行 | T225: 北京 | U225: 1.29 | V225: 3.8599999999999999 | W225: 259019 | X225: 280944 | Y225: 0.92000000000000004 | Z225: 14928 | AA225: 4495 | AB225: 0.01
A226: ="002142" -> 002142 | B226: 宁波银行 | C226: 0.10000000000000001 | D226: 33504 | E226: 899.27亿 | F226: 0.070000000000000007 | G226: 19.420000000000002 | H226: 19.34 | I226: 19.420000000000002 | J226: 185 | K226: 1.2 | L226: 19.170000000000002 | M226: 19.469999999999999 | N226: 19.010000000000002 | O226: 19.399999999999999 | P226: 8.5 | Q226: 64234612 | R226: 4.4900000000000002 | S226: 银行 | T226: 浙江 | U226: 2.3700000000000001 | V226: 19.170000000000002 | W226: 13238 | X226: 20266 | Y226: 0.65000000000000002 | Z226: 27 | AA226: 191 | AB226: 0.02
A227: ="601328" -> 601328 | B227: 交通银行 | C227: -0.46000000000000002 | D227: 271578 | E227: 2555.23亿 | F227: 0.070000000000000007 | G227: 6.5099999999999998 | H227: 6.5099999999999998 | I227: 6.5199999999999996 | J227: 601 | K227: -0.29999999999999999 | L227: 6.4699999999999998 | M227: 6.54 | N227: 6.4400000000000004 | O227: 6.54 | P227: 6.3300000000000001 | Q227: 176178112 | R227: 6.6200000000000001 | S227: 银行 | T227: 上海 | U227: 1.53 | V227: 6.4900000000000002 | W227: 113677 | X227: 157900 | Y227: 0.71999999999999997 | Z227: 282 | AA227: 6924 | AB227: -0.029999999999999999
A228: ="601398" -> 601398 | B228: 工商银行 | C228: -0.51000000000000001 | D228: 754857 | E228: 15826.24亿 | F228: 0.029999999999999999 | G228: 5.8700000000000001 | H228: 5.8600000000000003 | I228: 5.8700000000000001 | J228: 637 | K228: 0.34000000000000002 | L228: 5.8899999999999997 | M228: 5.9000000000000004 | N228: 5.8200000000000003 | O228: 5.9000000000000004 | P228: 6.5499999999999998 | Q228: 442742400 | R228: 6.9299999999999997 | S228: 银行 | T228: 北京 | U228: 1.3600000000000001 | V228: 5.8700000000000001 | W228: 435478 | X228: 319379 | Y228: 1.3600000000000001 | Z228: 21193 | AA228: 2649 | AB228: -0.029999999999999999
A229: ="000001" -> 000001 | B229: 平安银行 | C229: -0.64000000000000001 | D229: 267730 | E229: 2141.13亿 | F229: 0.16 | G229: 12.470000000000001 | H229: 12.460000000000001 | I229: 12.470000000000001 | J229: 586 | K229: 0.72999999999999998 | L229: 12.550000000000001 | M229: 12.550000000000001 | N229: 12.25 | O229: 12.550000000000001 | P229: 7.8499999999999996 | Q229: 332927904 | R229: 5.2000000000000002 | S229: 银行 | T229: 深圳 | U229: 2.3900000000000001 | V229: 12.44 | W229: 133332 | X229: 134398 | Y229: 0.98999999999999999 | Z229: 550 | AA229: 65 | AB229: -0.080000000000000002
A230: ="601288" -> 601288 | B230: 农业银行 | C230: -0.77000000000000002 | D230: 953932 | E230: 11321.13亿 | F230: 0.029999999999999999 | G230: 3.8500000000000001 | H230: 3.8399999999999999 | I230: 3.8500000000000001 | J230: 5992 | K230: 0.52000000000000002 | L230: 3.8500000000000001 | M230: 3.8599999999999999 | N230: 3.8199999999999998 | O230: 3.8799999999999999 | P230: 5.8899999999999997 | Q230: 366479424 | R230: 6.29 | S230: 银行 | T230: 北京 | U230: 1.03 | V230: 3.8399999999999999 | W230: 537662 | X230: 416270 | Y230: 1.29 | Z230: 74039 | AA230: 16654 | AB230: -0.029999999999999999
A231: ="601939" -> 601939 | B231: 建设银行 | C231: -0.94999999999999996 | D231: 362429 | E231: 701.30亿 | F231: 0.38 | G231: 7.3099999999999996 | H231: 7.3099999999999996 | I231: 7.3200000000000003 | J231: 1559 | K231: 0.27000000000000002 | L231: 7.2999999999999998 | M231: 7.3399999999999999 | N231: 7.2300000000000004 | O231: 7.3799999999999999 | P231: 6.4000000000000004 | Q231: 263798560 | R231: 6.71 | S231: 银行 | T231: 北京 | U231: 1.49 | V231: 7.2800000000000002 | W231: 156659 | X231: 205769 | Y231: 0.76000000000000001 | Z231: 1491 | AA231: 4442 | AB231: -0.070000000000000007
A232: ="002238" -> 002238 | B232: 天威视讯 | C232: -2.7400000000000002 | D232: 21731 | E232: 48.15亿 | F232: 0.34999999999999998 | G232: 7.7999999999999998 | H232: 7.79 | I232: 7.7999999999999998 | J232: 162 | K232: 0 | L232: 7.8200000000000003 | M232: 7.8700000000000001 | N232: 7.7000000000000002 | O232: 8.0199999999999996 | P232: 23.969999999999999 | Q232: 16935940 | R232: 3.5800000000000001 | S232: 影视音像 | T232: 深圳 | U232: 2.1200000000000001 | V232: 7.79 | W232: 12019 | X232: 9711 | Y232: 1.24 | Z232: 48 | AA232: 191 | AB232: -0.22
A233: ="002475" -> 002475 | B233: 立讯精密 | C233: 0.60999999999999999 | D233: 66600 | E233: 876.77亿 | F233: 0.16 | G233: 21.329999999999998 | H233: 21.32 | I233: 21.329999999999998 | J233: 112 | K233: 0.56999999999999995 | L233: 21.359999999999999 | M233: 21.449999999999999 | N233: 21 | O233: 21.199999999999999 | P233: 39.719999999999999 | Q233: 141492048 | R233: 3.4300000000000002 | S233: 元器件 | T233: 深圳 | U233: 2.1200000000000001 | V233: 21.239999999999998 | W233: 24695 | X233: 41905 | Y233: 0.58999999999999997 | Z233: 55 | AA233: 657 | AB233: 0.13
A234: ="002025" -> 002025 | B234: 航天电器 | C234: 0.17999999999999999 | D234: 7039 | E234: 119.15亿 | F234: 0.16 | G234: 27.780000000000001 | H234: 27.75 | I234: 27.77 | J234: 29 | K234: 0.93999999999999995 | L234: 27.800000000000001 | M234: 27.850000000000001 | N234: 27.420000000000002 | O234: 27.73 | P234: 33.560000000000002 | Q234: 19504224 | R234: 2.6000000000000001 | S234: 元器件 | T234: 贵州 | U234: 1.55 | V234: 27.710000000000001 | W234: 4161 | X234: 2878 | Y234: 1.45 | Z234: 50 | AA234: 10 | AB234: 0.050000000000000003
A235: ="002179" -> 002179 | B235: 中航光电 | C235: -1 | D235: 4847 | E235: 324.02亿 | F235: 0.059999999999999998 | G235: 41.409999999999997 | H235: 41.409999999999997 | I235: 41.460000000000001 | J235: 2 | K235: 0.17000000000000001 | L235: 41.399999999999999 | M235: 41.490000000000002 | N235: 41.210000000000001 | O235: 41.829999999999998 | P235: 35.240000000000002 | Q235: 20040834 | R235: 2.1200000000000001 | S235: 元器件 | T235: 河南 | U235: 0.67000000000000004 | V235: 41.350000000000001 | W235: 2431 | X235: 2415 | Y235: 1.01 | Z235: 12 | AA235: 1 | AB235: -0.41999999999999998
A236: ="002134" -> 002134 | B236: 天津普林 | C236: -1.1799999999999999 | D236: 3983 | E236: 16.50亿 | F236: 0.16 | G236: 6.71 | H236: 6.71 | I236: 6.7199999999999998 | J236: 5 | K236: 0.14999999999999999 | L236: 6.7999999999999998 | M236: 6.7999999999999998 | N236: 6.6299999999999999 | O236: 6.79 | P236: -- | Q236: 2674063 | R236: 2.1000000000000001 | S236: 元器件 | T236: 天津 | U236: 2.5 | V236: 6.71 | W236: 1959 | X236: 2024 | Y236: 0.96999999999999997 | Z236: 5 | AA236: 63 | AB236: -0.080000000000000002
A237: ="002463" -> 002463 | B237: 沪电股份 | C237: -1.3600000000000001 | D237: 159747 | E237: 193.98亿 | F237: 0.94999999999999996 | G237: 11.59 | H237: 11.59 | I237: 11.6 | J237: 1286 | K237: 1.8500000000000001 | L237: 11.76 | M237: 11.800000000000001 | N237: 11.300000000000001 | O237: 11.75 | P237: 39.130000000000003 | Q237: 184369120 | R237: 4.1100000000000003 | S237: 元器件 | T237: 江苏 | U237: 4.2599999999999998 | V237: 11.539999999999999 | W237: 77657 | X237: 82089 | Y237: 0.94999999999999996 | Z237: 9 | AA237: 796 | AB237: -0.16
A238: ="002618" -> 002618 | B238: 丹邦科技 | C238: -1.48 | D238: 20740 | E238: 87.67亿 | F238: 0.38 | G238: 16 | H238: 16 | I238: 16.02 | J238: 78 | K238: 0.13 | L238: 16.100000000000001 | M238: 16.100000000000001 | N238: 15.9 | O238: 16.239999999999998 | P238: 261.62 | Q238: 33199188 | R238: 3.4100000000000001 | S238: 元器件 | T238: 深圳 | U238: 1.23 | V238: 16.010000000000002 | W238: 13440 | X238: 7300 | Y238: 1.8400000000000001 | Z238: 95 | AA238: 92 | AB238: -0.23999999999999999
A239: ="600183" -> 600183 | B239: 生益科技 | C239: -1.53 | D239: 55394 | E239: 258.55亿 | F239: 0.26000000000000001 | G239: 12.210000000000001 | H239: 12.210000000000001 | I239: 12.220000000000001 | J239: 63 | K239: -0.23999999999999999 | L239: 12.460000000000001 | M239: 12.460000000000001 | N239: 12.15 | O239: 12.4 | P239: 23.940000000000001 | Q239: 67846400 | R239: 3.0800000000000001 | S239: 元器件 | T239: 广东 | U239: 2.5 | V239: 12.25 | W239: 30634 | X239: 24759 | Y239: 1.24 | Z239: 363 | AA239: 266 | AB239: -0.19
A240: ="600563" -> 600563 | B240: 法拉电子 | C240: -1.5800000000000001 | D240: 2473 | E240: 108.09亿 | F240: 0.11 | G240: 48.039999999999999 | H240: 48.039999999999999 | I240: 48.090000000000003 | J240: 4 | K240: -0.60999999999999999 | L240: 48.5 | M240: 48.890000000000001 | N240: 48.009999999999998 | O240: 48.810000000000002 | P240: 24.949999999999999 | Q240: 11964782 | R240: 2.7799999999999998 | S240: 元器件 | T240: 福建 | U240: 1.8 | V240: 48.380000000000003 | W240: 1311 | X240: 1162 | Y240: 1.1299999999999999 | Z240: 1 | AA240: 22 | AB240: -0.77000000000000002
A241: ="000823" -> 000823 | B241: 超声电子 | C241: -2.1000000000000001 | D241: 42735 | E241: 55.14亿 | F241: 0.80000000000000004 | G241: 10.27 | H241: 10.27 | I241: 10.279999999999999 | J241: 176 | K241: 0 | L241: 10.310000000000001 | M241: 10.32 | N241: 10.210000000000001 | O241: 10.49 | P241: 22.73 | Q241: 43859352 | R241: 2.2799999999999998 | S241: 元器件 | T241: 广东 | U241: 1.05 | V241: 10.26 | W241: 24028 | X241: 18707 | Y241: 1.28 | Z241: 749 | AA241: 130 | AB241: -0.22
A242: ="002579" -> 002579 | B242: 中京电子 | C242: -2.25 | D242: 26280 | E242: 39.24亿 | F242: 0.76000000000000001 | G242: 11.310000000000001 | H242: 11.33 | I242: 11.34 | J242: 12 | K242: 0.97999999999999998 | L242: 11.5 | M242: 11.5 | N242: 11.15 | O242: 11.57 | P242: 53.43 | Q242: 29564002 | R242: 2.4100000000000001 | S242: 元器件 | T242: 广东 | U242: 3.0299999999999998 | V242: 11.25 | W242: 15863 | X242: 10416 | Y242: 1.52 | Z242: 30 | AA242: 86 | AB242: -0.26000000000000001
A243: ="300256" -> 300256 | B243: 星星科技 | C243: -2.4500000000000002 | D243: 93045 | E243: 30.86亿 | F243: 1.2 | G243: 3.98 | H243: 3.98 | I243: 3.9900000000000002 | J243: 838 | K243: -0.23999999999999999 | L243: 4.0599999999999996 | M243: 4.0800000000000001 | N243: 3.9500000000000002 | O243: 4.0800000000000001 | P243: 40.079999999999998 | Q243: 37098648 | R243: 2.75 | S243: 元器件 | T243: 浙江 | U243: 3.1899999999999999 | V243: 3.9900000000000002 | W243: 53768 | X243: 39276 | Y243: 1.3700000000000001 | Z243: 70 | AA243: 942 | AB243: -0.10000000000000001
A244: ="600082" -> 600082 | B244: 海泰发展 | C244: -1.3799999999999999 | D244: 44843 | E244: 31.76亿 | F244: 0.70999999999999996 | G244: 5.0099999999999998 | H244: 5.0099999999999998 | I244: 5.0199999999999996 | J244: 43 | K244: -0.39000000000000001 | L244: 5.0800000000000001 | M244: 5.0800000000000001 | N244: 4.9000000000000004 | O244: 5.0800000000000001 | P244: 2253.3699999999999 | Q244: 22358126 | R244: 3.1800000000000002 | S244: 园区开发 | T244: 天津 | U244: 3.54 | V244: 4.9900000000000002 | W244: 23359 | X244: 21484 | Y244: 1.0900000000000001 | Z244: 227 | AA244: 746 | AB244: -0.070000000000000007
A245: ="601688" -> 601688 | B245: 华泰证券 | C245: 5.4000000000000004 | D245: 422806 | E245: 1413.19亿 | F245: 0.78000000000000003 | G245: 25.960000000000001 | H245: 25.960000000000001 | I245: 25.969999999999999 | J245: 467 | K245: 4.3399999999999999 | L245: 25.120000000000001 | M245: 25.98 | N245: 24.829999999999998 | O245: 24.629999999999999 | P245: 35.859999999999999 | Q245: 1063874752 | R245: 9.9700000000000006 | S245: 证券 | T245: 江苏 | U245: 4.6699999999999999 | V245: 25.16 | W245: 189183 | X245: 233622 | Y245: 0.81000000000000005 | Z245: 57 | AA245: 28 | AB245: 1.3300000000000001
A246: ="600030" -> 600030 | B246: 中信证券 | C246: 5.1900000000000004 | D246: 1060903 | E246: 2546.90亿 | F246: 1.0800000000000001 | G246: 25.949999999999999 | H246: 25.940000000000001 | I246: 25.949999999999999 | J246: 6895 | K246: 2.98 | L246: 25.420000000000002 | M246: 26.100000000000001 | N246: 24.899999999999999 | O246: 24.670000000000002 | P246: 32.240000000000002 | Q246: 2698223872 | R246: 9.6600000000000001 | S246: 证券 | T246: 深圳 | U246: 4.8600000000000003 | V246: 25.43 | W246: 422349 | X246: 638554 | Y246: 0.66000000000000003 | Z246: 50 | AA246: 36 | AB246: 1.28
A247: ="601901" -> 601901 | B247: 方正证券 | C247: 4.3499999999999996 | D247: 320786 | E247: 691.50亿 | F247: 0.39000000000000001 | G247: 8.4000000000000004 | H247: 8.4000000000000004 | I247: 8.4100000000000001 | J247: 1327 | K247: 5.6600000000000001 | L247: 8.0999999999999996 | M247: 8.4000000000000004 | N247: 7.9000000000000004 | O247: 8.0500000000000007 | P247: 114.09 | Q247: 259792000 | R247: 8.0399999999999991 | S247: 证券 | T247: 湖南 | U247: 6.21 | V247: 8.0999999999999996 | W247: 131876 | X247: 188909 | Y247: 0.69999999999999996 | Z247: 95 | AA247: 208 | AB247: 0.34999999999999998
A248: ="000783" -> 000783 | B248: 长江证券 | C248: 4.0700000000000003 | D248: 264782 | E248: 438.48亿 | F248: 0.47999999999999998 | G248: 7.9299999999999997 | H248: 7.9199999999999999 | I248: 7.9299999999999997 | J248: 1609 | K248: 4.0700000000000003 | L248: 7.79 | M248: 7.9500000000000002 | N248: 7.5 | O248: 7.6200000000000001 | P248: 57.579999999999998 | Q248: 204636768 | R248: 6.21 | S248: 证券 | T248: 湖北 | U248: 5.9100000000000001 | V248: 7.7300000000000004 | W248: 119925 | X248: 144857 | Y248: 0.82999999999999996 | Z248: 538 | AA248: 147 | AB248: 0.31
A249: ="000728" -> 000728 | B249: 国元证券 | C249: 2.8199999999999998 | D249: 186357 | E249: 311.70亿 | F249: 0.63 | G249: 10.58 | H249: 10.58 | I249: 10.59 | J249: 654 | K249: 4.5499999999999998 | L249: 10.5 | M249: 10.59 | N249: 10.02 | O249: 10.289999999999999 | P249: 81.390000000000001 | Q249: 193428528 | R249: 6.3899999999999997 | S249: 证券 | T249: 安徽 | U249: 5.54 | V249: 10.380000000000001 | W249: 76926 | X249: 109431 | Y249: 0.69999999999999996 | Z249: 229 | AA249: 2186 | AB249: 0.28999999999999998
A250: ="600837" -> 600837 | B250: 海通证券 | C250: 1.1399999999999999 | D250: 435314 | E250: 1144.23亿 | F250: 0.54000000000000004 | G250: 14.140000000000001 | H250: 14.140000000000001 | I250: 14.16 | J250: 4098 | K250: 3.29 | L250: 14.119999999999999 | M250: 14.16 | N250: 13.6 | O250: 13.98 | P250: 34 | Q250: 607832128 | R250: 8.0999999999999996 | S250: 证券 | T250: 上海 | U250: 4.0099999999999998 | V250: 13.960000000000001 | W250: 168737 | X250: 266576 | Y250: 0.63 | Z250: 1031 | AA250: 152 | AB250: 0.16
A251: ="300049" -> 300049 | B251: 福瑞股份 | C251: -0.10000000000000001 | D251: 3873 | E251: 22.98亿 | F251: 0.17000000000000001 | G251: 10.08 | H251: 10.08 | I251: 10.09 | J251: 76 | K251: 0.20000000000000001 | L251: 10.140000000000001 | M251: 10.17 | N251: 10.02 | O251: 10.09 | P251: 33.950000000000003 | Q251: 3904366 | R251: 2.8900000000000001 | S251: 中成药 | T251: 内蒙 | U251: 1.49 | V251: 10.08 | W251: 2382 | X251: 1491 | Y251: 1.6000000000000001 | Z251: 367 | AA251: 97 | AB251: -0.01
A252: ="600436" -> 600436 | B252: 片仔癀 | C252: -0.23000000000000001 | D252: 8969 | E252: 638.13亿 | F252: 0.14999999999999999 | G252: 105.77 | H252: 105.77 | I252: 105.84999999999999 | J252: 17 | K252: 0.45000000000000001 | L252: 107 | M252: 107.2 | N252: 104.91 | O252: 106.01000000000001 | P252: 52.020000000000003 | Q252: 95063280 | R252: 4 | S252: 中成药 | T252: 福建 | U252: 2.1600000000000001 | V252: 105.99 | W252: 5408 | X252: 3560 | Y252: 1.52 | Z252: 1 | AA252: 2 | AB252: -0.23999999999999999
A253: ="600750" -> 600750 | B253: 江中药业 | C253: -0.44 | D253: 8407 | E253: 75.60亿 | F253: 0.20000000000000001 | G253: 18 | H253: 17.989999999999998 | I253: 18 | J253: 342 | K253: 0.28000000000000003 | L253: 18.010000000000002 | M253: 18.010000000000002 | N253: 17.879999999999999 | O253: 18.079999999999998 | P253: 16.030000000000001 | Q253: 15092578 | R253: 3.4100000000000001 | S253: 中成药 | T253: 江西 | U253: 0.71999999999999997 | V253: 17.949999999999999 | W253: 3347 | X253: 5060 | Y253: 0.66000000000000003 | Z253: 490 | AA253: 346 | AB253: -0.080000000000000002
A254: ="002690" -> 002690 | B254: 美亚光电 | C254: 1.21 | D254: 7107 | E254: 79.26亿 | F254: 0.22 | G254: 24.210000000000001 | H254: 24.199999999999999 | I254: 24.210000000000001 | J254: 82 | K254: 1.1699999999999999 | L254: 23.920000000000002 | M254: 24.25 | N254: 23.75 | O254: 23.920000000000002 | P254: 38.369999999999997 | Q254: 17059580 | R254: 3.6200000000000001 | S254: 专用机械 | T254: 安徽 | U254: 2.0899999999999999 | V254: 24 | W254: 2739 | X254: 4368 | Y254: 0.63 | Z254: 695 | AA254: 42 | AB254: 0.28999999999999998
A255: ="002621" -> 002621 | B255: 三垒股份 | C255: -0.59999999999999998 | D255: 1885 | E255: 62.80亿 | F255: 0.070000000000000007 | G255: 23.199999999999999 | H255: 23.16 | I255: 23.27 | J255: 6 | K255: 1.6200000000000001 | L255: 23.34 | M255: 23.350000000000001 | N255: 22.809999999999999 | O255: 23.34 | P255: 451.55000000000001 | Q255: 4344774 | R255: 1.6000000000000001 | S255: 专用机械 | T255: 辽宁 | U255: 2.3100000000000001 | V255: 23.050000000000001 | W255: 960 | X255: 924 | Y255: 1.04 | Z255: 20 | AA255: 6 | AB255: -0.14000000000000001
A256: ="002639" -> 002639 | B256: 雪人股份 | C256: -0.59999999999999998 | D256: 46788 | E256: 42.59亿 | F256: 0.91000000000000003 | G256: 8.25 | H256: 8.2400000000000002 | I256: 8.25 | J256: 173 | K256: 0.48999999999999999 | L256: 8.3599999999999994 | M256: 8.3599999999999994 | N256: 8.1600000000000001 | O256: 8.3000000000000007 | P256: 304.17000000000002 | Q256: 38626608 | R256: 2.6299999999999999 | S256: 专用机械 | T256: 福建 | U256: 2.4100000000000001 | V256: 8.2599999999999998 | W256: 29248 | X256: 17540 | Y256: 1.6699999999999999 | Z256: 715 | AA256: 91 | AB256: -0.050000000000000003
A257: ="002371" -> 002371 | B257: 北方华创 | C257: -1.1299999999999999 | D257: 10474 | E257: 189.37亿 | F257: 0.28999999999999998 | G257: 52.700000000000003 | H257: 52.670000000000002 | I257: 52.700000000000003 | J257: 12 | K257: 0.83999999999999997 | L257: 53 | M257: 53 | N257: 52.009999999999998 | O257: 53.299999999999997 | P257: 107.34 | Q257: 55013012 | R257: 2.1400000000000001 | S257: 专用机械 | T257: 北京 | U257: 1.8600000000000001 | V257: 52.520000000000003 | W257: 5706 | X257: 4767 | Y257: 1.2 | Z257: 8 | AA257: 14 | AB257: -0.59999999999999998
A258: ="000925" -> 000925 | B258: 众合科技 | C258: -1.1799999999999999 | D258: 20112 | E258: 34.36亿 | F258: 0.44 | G258: 7.5099999999999998 | H258: 7.5099999999999998 | I258: 7.54 | J258: 34 | K258: 0.54000000000000004 | L258: 7.5800000000000001 | M258: 7.5800000000000001 | N258: 7.4299999999999997 | O258: 7.5999999999999996 | P258: 75.730000000000004 | Q258: 15043413 | R258: 2.6600000000000001 | S258: 专用机械 | T258: 浙江 | U258: 1.97 | V258: 7.4800000000000004 | W258: 9746 | X258: 10366 | Y258: 0.93999999999999995 | Z258: 221 | AA258: 6 | AB258: -0.089999999999999997
A259: ="002595" -> 002595 | B259: 豪迈科技 | C259: -2.4700000000000002 | D259: 2212 | E259: 96.02亿 | F259: 0.040000000000000001 | G259: 18.190000000000001 | H259: 18.170000000000002 | I259: 18.190000000000001 | J259: 30 | K259: 0.22 | L259: 18.629999999999999 | M259: 18.629999999999999 | N259: 18.100000000000001 | O259: 18.649999999999999 | P259: 18.920000000000002 | Q259: 4024939 | R259: 3.4100000000000001 | S259: 专用机械 | T259: 山东 | U259: 2.8399999999999999 | V259: 18.199999999999999 | W259: 1084 | X259: 1128 | Y259: 0.95999999999999996 | Z259: 16 | AA259: 16 | AB259: -0.46000000000000002
A260: ="002163" -> 002163 | B260: 中航三鑫 | C260: -0.92000000000000004 | D260: 12656 | E260: 43.30亿 | F260: 0.16 | G260: 5.3899999999999997 | H260: 5.3899999999999997 | I260: 5.4000000000000004 | J260: 123 | K260: 0.93999999999999995 | L260: 5.4400000000000004 | M260: 5.4400000000000004 | N260: 5.3399999999999999 | O260: 5.4400000000000004 | P260: -- | Q260: 6807475 | R260: 3.6099999999999999 | S260: 装修装饰 | T260: 深圳 | U260: 1.8400000000000001 | V260: 5.3799999999999999 | W260: 4828 | X260: 7828 | Y260: 0.62 | Z260: 153 | AA260: 239 | AB260: -0.050000000000000003
A261: ="600647" -> 600647 | B261: 同达创业 | C261: -3.0699999999999998 | D261: 2703 | E261: 19.80亿 | F261: 0.19 | G261: 14.23 | H261: 14.23 | I261: 14.26 | J261: 2 | K261: -0.82999999999999996 | L261: 14.390000000000001 | M261: 14.550000000000001 | N261: 14.15 | O261: 14.68 | P261: -- | Q261: 3865849 | R261: 4.5499999999999998 | S261: 综合类 | T261: 上海 | U261: 2.7200000000000002 | V261: 14.300000000000001 | W261: 1182 | X261: 1521 | Y261: 0.78000000000000003 | Z261: 8 | AA261: 19 | AB261: -0.45000000000000001